Training:   0%|          | 0/250 [00:00<?, ?it/s]Training:   0%|          | 0/250 [00:52<?, ?it/s, mae=137.61]Training:   0%|          | 1/250 [00:52<3:36:58, 52.28s/it, mae=137.61]Training:   0%|          | 1/250 [00:53<3:36:58, 52.28s/it, mae=131.17]Training:   1%|          | 2/250 [00:53<1:31:01, 22.02s/it, mae=131.17]Training:   1%|          | 2/250 [00:53<1:31:01, 22.02s/it, mae=128.44]Training:   1%|          | 3/250 [00:53<50:22, 12.24s/it, mae=128.44]  Training:   1%|          | 3/250 [00:54<50:22, 12.24s/it, mae=129.69]Training:   2%|▏         | 4/250 [00:54<31:21,  7.65s/it, mae=129.69]Training:   2%|▏         | 4/250 [00:54<31:21,  7.65s/it, mae=129.24]Training:   2%|▏         | 5/250 [00:54<20:53,  5.12s/it, mae=129.24]Training:   2%|▏         | 5/250 [00:55<20:53,  5.12s/it, mae=130.05]Training:   2%|▏         | 6/250 [00:55<14:35,  3.59s/it, mae=130.05]Training:   2%|▏         | 6/250 [00:56<14:35,  3.59s/it, mae=129.37]Training:   3%|▎         | 7/250 [00:56<10:34,  2.61s/it, mae=129.37]Training:   3%|▎         | 7/250 [00:56<10:34,  2.61s/it, mae=128.68]Training:   3%|▎         | 8/250 [00:56<07:58,  1.98s/it, mae=128.68]Training:   3%|▎         | 8/250 [00:57<07:58,  1.98s/it, mae=129.24]Training:   4%|▎         | 9/250 [00:57<06:13,  1.55s/it, mae=129.24]Training:   4%|▎         | 9/250 [00:58<06:13,  1.55s/it, mae=128.35]Training:   4%|▍         | 10/250 [00:58<05:02,  1.26s/it, mae=128.35]Training:   4%|▍         | 10/250 [00:58<05:02,  1.26s/it, mae=127.46]Training:   4%|▍         | 11/250 [00:58<04:13,  1.06s/it, mae=127.46]Training:   4%|▍         | 11/250 [00:59<04:13,  1.06s/it, mae=127.77]Training:   5%|▍         | 12/250 [00:59<03:42,  1.07it/s, mae=127.77]Training:   5%|▍         | 12/250 [00:59<03:42,  1.07it/s, mae=127.53]Training:   5%|▌         | 13/250 [00:59<03:18,  1.19it/s, mae=127.53]Training:   5%|▌         | 13/250 [01:00<03:18,  1.19it/s, mae=127.46]Training:   6%|▌         | 14/250 [01:00<03:01,  1.30it/s, mae=127.46]Training:   6%|▌         | 14/250 [01:01<03:01,  1.30it/s, mae=126.92]Training:   6%|▌         | 15/250 [01:01<02:49,  1.38it/s, mae=126.92]Training:   6%|▌         | 15/250 [01:01<02:49,  1.38it/s, mae=126.51]Training:   6%|▋         | 16/250 [01:01<02:41,  1.45it/s, mae=126.51]Training:   6%|▋         | 16/250 [01:02<02:41,  1.45it/s, mae=126.26]Training:   7%|▋         | 17/250 [01:02<02:35,  1.50it/s, mae=126.26]Training:   7%|▋         | 17/250 [01:02<02:35,  1.50it/s, mae=125.49]Training:   7%|▋         | 18/250 [01:02<02:31,  1.54it/s, mae=125.49]Training:   7%|▋         | 18/250 [01:03<02:31,  1.54it/s, mae=125.41]Training:   8%|▊         | 19/250 [01:03<02:27,  1.56it/s, mae=125.41]Training:   8%|▊         | 19/250 [01:04<02:27,  1.56it/s, mae=125.05]Training:   8%|▊         | 20/250 [01:04<02:25,  1.58it/s, mae=125.05]Training:   8%|▊         | 20/250 [01:04<02:25,  1.58it/s, mae=124.54]Training:   8%|▊         | 21/250 [01:04<02:23,  1.60it/s, mae=124.54]Training:   8%|▊         | 21/250 [01:05<02:23,  1.60it/s, mae=124.02]Training:   9%|▉         | 22/250 [01:05<02:22,  1.60it/s, mae=124.02]Training:   9%|▉         | 22/250 [01:06<02:22,  1.60it/s, mae=124.28]Training:   9%|▉         | 23/250 [01:06<02:20,  1.61it/s, mae=124.28]Training:   9%|▉         | 23/250 [01:06<02:20,  1.61it/s, mae=124.25]Training:  10%|▉         | 24/250 [01:06<02:20,  1.61it/s, mae=124.25]Training:  10%|▉         | 24/250 [01:07<02:20,  1.61it/s, mae=124.07]Training:  10%|█         | 25/250 [01:07<02:19,  1.62it/s, mae=124.07]Training:  10%|█         | 25/250 [01:07<02:19,  1.62it/s, mae=123.44]Training:  10%|█         | 26/250 [01:07<02:18,  1.62it/s, mae=123.44]Training:  10%|█         | 26/250 [01:08<02:18,  1.62it/s, mae=122.96]Training:  11%|█         | 27/250 [01:08<02:17,  1.62it/s, mae=122.96]Training:  11%|█         | 27/250 [01:09<02:17,  1.62it/s, mae=123.30]Training:  11%|█         | 28/250 [01:09<02:21,  1.57it/s, mae=123.30]Training:  11%|█         | 28/250 [01:09<02:21,  1.57it/s, mae=123.28]Training:  12%|█▏        | 29/250 [01:09<02:18,  1.60it/s, mae=123.28]Training:  12%|█▏        | 29/250 [01:10<02:18,  1.60it/s, mae=123.39]Training:  12%|█▏        | 30/250 [01:10<02:17,  1.60it/s, mae=123.39]Training:  12%|█▏        | 30/250 [01:11<02:17,  1.60it/s, mae=123.36]Training:  12%|█▏        | 31/250 [01:11<02:16,  1.61it/s, mae=123.36]Training:  12%|█▏        | 31/250 [01:11<02:16,  1.61it/s, mae=123.63]Training:  13%|█▎        | 32/250 [01:11<02:17,  1.58it/s, mae=123.63]Training:  13%|█▎        | 32/250 [01:12<02:17,  1.58it/s, mae=123.73]Training:  13%|█▎        | 33/250 [01:12<02:15,  1.60it/s, mae=123.73]Training:  13%|█▎        | 33/250 [01:12<02:15,  1.60it/s, mae=123.52]Training:  14%|█▎        | 34/250 [01:12<02:14,  1.61it/s, mae=123.52]Training:  14%|█▎        | 34/250 [01:13<02:14,  1.61it/s, mae=123.33]Training:  14%|█▍        | 35/250 [01:13<02:13,  1.61it/s, mae=123.33]Training:  14%|█▍        | 35/250 [01:14<02:13,  1.61it/s, mae=123.40]Training:  14%|█▍        | 36/250 [01:14<02:12,  1.61it/s, mae=123.40]Training:  14%|█▍        | 36/250 [01:14<02:12,  1.61it/s, mae=123.53]Training:  15%|█▍        | 37/250 [01:14<02:11,  1.62it/s, mae=123.53]Training:  15%|█▍        | 37/250 [01:15<02:11,  1.62it/s, mae=123.61]Training:  15%|█▌        | 38/250 [01:15<02:10,  1.62it/s, mae=123.61]Training:  15%|█▌        | 38/250 [01:15<02:10,  1.62it/s, mae=123.68]Training:  16%|█▌        | 39/250 [01:15<02:10,  1.62it/s, mae=123.68]Training:  16%|█▌        | 39/250 [01:16<02:10,  1.62it/s, mae=123.91]Training:  16%|█▌        | 40/250 [01:16<02:09,  1.62it/s, mae=123.91]Training:  16%|█▌        | 40/250 [01:17<02:09,  1.62it/s, mae=123.93]Training:  16%|█▋        | 41/250 [01:17<02:11,  1.59it/s, mae=123.93]Training:  16%|█▋        | 41/250 [01:17<02:11,  1.59it/s, mae=123.84]Training:  17%|█▋        | 42/250 [01:17<02:09,  1.61it/s, mae=123.84]Training:  17%|█▋        | 42/250 [01:18<02:09,  1.61it/s, mae=124.03]Training:  17%|█▋        | 43/250 [01:18<02:08,  1.61it/s, mae=124.03]Training:  17%|█▋        | 43/250 [01:19<02:08,  1.61it/s, mae=124.11]Training:  18%|█▊        | 44/250 [01:19<02:07,  1.62it/s, mae=124.11]Training:  18%|█▊        | 44/250 [01:19<02:07,  1.62it/s, mae=124.18]Training:  18%|█▊        | 45/250 [01:19<02:06,  1.62it/s, mae=124.18]Training:  18%|█▊        | 45/250 [01:20<02:06,  1.62it/s, mae=124.25]Training:  18%|█▊        | 46/250 [01:20<02:06,  1.62it/s, mae=124.25]Training:  18%|█▊        | 46/250 [01:20<02:06,  1.62it/s, mae=124.10]Training:  19%|█▉        | 47/250 [01:20<02:05,  1.62it/s, mae=124.10]Training:  19%|█▉        | 47/250 [01:21<02:05,  1.62it/s, mae=124.39]Training:  19%|█▉        | 48/250 [01:21<02:04,  1.62it/s, mae=124.39]Training:  19%|█▉        | 48/250 [01:22<02:04,  1.62it/s, mae=124.30]Training:  20%|█▉        | 49/250 [01:22<02:06,  1.59it/s, mae=124.30]Training:  20%|█▉        | 49/250 [01:22<02:06,  1.59it/s, mae=124.55]Training:  20%|██        | 50/250 [01:22<02:04,  1.61it/s, mae=124.55]Training:  20%|██        | 50/250 [01:23<02:04,  1.61it/s, mae=124.43]Training:  20%|██        | 51/250 [01:23<02:03,  1.61it/s, mae=124.43]Training:  20%|██        | 51/250 [01:24<02:03,  1.61it/s, mae=124.15]Training:  21%|██        | 52/250 [01:24<02:05,  1.58it/s, mae=124.15]Training:  21%|██        | 52/250 [01:24<02:05,  1.58it/s, mae=123.83]Training:  21%|██        | 53/250 [01:24<02:07,  1.55it/s, mae=123.83]Training:  21%|██        | 53/250 [01:25<02:07,  1.55it/s, mae=123.64]Training:  22%|██▏       | 54/250 [01:25<02:03,  1.58it/s, mae=123.64]Training:  22%|██▏       | 54/250 [01:25<02:03,  1.58it/s, mae=123.62]Training:  22%|██▏       | 55/250 [01:25<02:02,  1.59it/s, mae=123.62]Training:  22%|██▏       | 55/250 [01:26<02:02,  1.59it/s, mae=123.65]Training:  22%|██▏       | 56/250 [01:26<02:01,  1.60it/s, mae=123.65]Training:  22%|██▏       | 56/250 [01:27<02:01,  1.60it/s, mae=123.46]Training:  23%|██▎       | 57/250 [01:27<02:00,  1.60it/s, mae=123.46]Training:  23%|██▎       | 57/250 [01:27<02:00,  1.60it/s, mae=123.36]Training:  23%|██▎       | 58/250 [01:27<01:59,  1.61it/s, mae=123.36]Training:  23%|██▎       | 58/250 [01:28<01:59,  1.61it/s, mae=123.38]Training:  24%|██▎       | 59/250 [01:28<01:59,  1.59it/s, mae=123.38]Training:  24%|██▎       | 59/250 [01:29<01:59,  1.59it/s, mae=123.27]Training:  24%|██▍       | 60/250 [01:29<01:59,  1.59it/s, mae=123.27]Training:  24%|██▍       | 60/250 [01:29<01:59,  1.59it/s, mae=123.22]Training:  24%|██▍       | 61/250 [01:29<01:57,  1.60it/s, mae=123.22]Training:  24%|██▍       | 61/250 [01:30<01:57,  1.60it/s, mae=123.04]Training:  25%|██▍       | 62/250 [01:30<01:57,  1.60it/s, mae=123.04]Training:  25%|██▍       | 62/250 [01:30<01:57,  1.60it/s, mae=123.07]Training:  25%|██▌       | 63/250 [01:30<01:56,  1.61it/s, mae=123.07]Training:  25%|██▌       | 63/250 [01:31<01:56,  1.61it/s, mae=123.19]Training:  26%|██▌       | 64/250 [01:31<01:56,  1.59it/s, mae=123.19]Training:  26%|██▌       | 64/250 [01:32<01:56,  1.59it/s, mae=123.03]Training:  26%|██▌       | 65/250 [01:32<01:55,  1.60it/s, mae=123.03]Training:  26%|██▌       | 65/250 [01:32<01:55,  1.60it/s, mae=122.66]Training:  26%|██▋       | 66/250 [01:32<01:57,  1.57it/s, mae=122.66]Training:  26%|██▋       | 66/250 [01:33<01:57,  1.57it/s, mae=122.56]Training:  27%|██▋       | 67/250 [01:33<01:54,  1.60it/s, mae=122.56]Training:  27%|██▋       | 67/250 [01:34<01:54,  1.60it/s, mae=122.53]Training:  27%|██▋       | 68/250 [01:34<01:54,  1.60it/s, mae=122.53]Training:  27%|██▋       | 68/250 [01:34<01:54,  1.60it/s, mae=122.49]Training:  28%|██▊       | 69/250 [01:34<01:52,  1.61it/s, mae=122.49]Training:  28%|██▊       | 69/250 [01:35<01:52,  1.61it/s, mae=122.40]Training:  28%|██▊       | 70/250 [01:35<01:53,  1.59it/s, mae=122.40]Training:  28%|██▊       | 70/250 [01:35<01:53,  1.59it/s, mae=122.23]Training:  28%|██▊       | 71/250 [01:35<01:51,  1.60it/s, mae=122.23]Training:  28%|██▊       | 71/250 [01:36<01:51,  1.60it/s, mae=122.17]Training:  29%|██▉       | 72/250 [01:36<01:50,  1.61it/s, mae=122.17]Training:  29%|██▉       | 72/250 [01:37<01:50,  1.61it/s, mae=122.02]Training:  29%|██▉       | 73/250 [01:37<01:50,  1.60it/s, mae=122.02]Training:  29%|██▉       | 73/250 [01:37<01:50,  1.60it/s, mae=121.89]Training:  30%|██▉       | 74/250 [01:37<01:49,  1.61it/s, mae=121.89]Training:  30%|██▉       | 74/250 [01:38<01:49,  1.61it/s, mae=122.05]Training:  30%|███       | 75/250 [01:38<01:48,  1.61it/s, mae=122.05]Training:  30%|███       | 75/250 [01:39<01:48,  1.61it/s, mae=122.07]Training:  30%|███       | 76/250 [01:39<01:48,  1.61it/s, mae=122.07]Training:  30%|███       | 76/250 [01:39<01:48,  1.61it/s, mae=121.98]Training:  31%|███       | 77/250 [01:39<01:48,  1.59it/s, mae=121.98]Training:  31%|███       | 77/250 [01:40<01:48,  1.59it/s, mae=121.95]Training:  31%|███       | 78/250 [01:40<01:47,  1.60it/s, mae=121.95]Training:  31%|███       | 78/250 [01:40<01:47,  1.60it/s, mae=121.88]Training:  32%|███▏      | 79/250 [01:40<01:46,  1.60it/s, mae=121.88]Training:  32%|███▏      | 79/250 [01:41<01:46,  1.60it/s, mae=121.88]Training:  32%|███▏      | 80/250 [01:41<01:46,  1.60it/s, mae=121.88]Training:  32%|███▏      | 80/250 [01:42<01:46,  1.60it/s, mae=121.73]Training:  32%|███▏      | 81/250 [01:42<01:45,  1.61it/s, mae=121.73]Training:  32%|███▏      | 81/250 [01:42<01:45,  1.61it/s, mae=121.65]Training:  33%|███▎      | 82/250 [01:42<01:44,  1.61it/s, mae=121.65]Training:  33%|███▎      | 82/250 [01:43<01:44,  1.61it/s, mae=121.51]Training:  33%|███▎      | 83/250 [01:43<01:43,  1.61it/s, mae=121.51]Training:  33%|███▎      | 83/250 [01:44<01:43,  1.61it/s, mae=121.44]Training:  34%|███▎      | 84/250 [01:44<01:43,  1.61it/s, mae=121.44]Training:  34%|███▎      | 84/250 [01:44<01:43,  1.61it/s, mae=121.37]Training:  34%|███▍      | 85/250 [01:44<01:42,  1.61it/s, mae=121.37]Training:  34%|███▍      | 85/250 [01:45<01:42,  1.61it/s, mae=121.44]Training:  34%|███▍      | 86/250 [01:45<01:44,  1.57it/s, mae=121.44]Training:  34%|███▍      | 86/250 [01:45<01:44,  1.57it/s, mae=121.38]Training:  35%|███▍      | 87/250 [01:45<01:42,  1.59it/s, mae=121.38]Training:  35%|███▍      | 87/250 [01:46<01:42,  1.59it/s, mae=121.10]Training:  35%|███▌      | 88/250 [01:46<01:41,  1.60it/s, mae=121.10]Training:  35%|███▌      | 88/250 [01:47<01:41,  1.60it/s, mae=121.16]Training:  36%|███▌      | 89/250 [01:47<01:40,  1.61it/s, mae=121.16]Training:  36%|███▌      | 89/250 [01:47<01:40,  1.61it/s, mae=121.15]Training:  36%|███▌      | 90/250 [01:47<01:39,  1.60it/s, mae=121.15]Training:  36%|███▌      | 90/250 [01:48<01:39,  1.60it/s, mae=120.82]Training:  36%|███▋      | 91/250 [01:48<01:38,  1.61it/s, mae=120.82]Training:  36%|███▋      | 91/250 [01:49<01:38,  1.61it/s, mae=120.76]Training:  37%|███▋      | 92/250 [01:49<01:38,  1.61it/s, mae=120.76]Training:  37%|███▋      | 92/250 [01:49<01:38,  1.61it/s, mae=120.65]Training:  37%|███▋      | 93/250 [01:49<01:37,  1.60it/s, mae=120.65]Training:  37%|███▋      | 93/250 [01:50<01:37,  1.60it/s, mae=120.59]Training:  38%|███▊      | 94/250 [01:50<01:36,  1.61it/s, mae=120.59]Training:  38%|███▊      | 94/250 [01:50<01:36,  1.61it/s, mae=120.48]Training:  38%|███▊      | 95/250 [01:50<01:37,  1.60it/s, mae=120.48]Training:  38%|███▊      | 95/250 [01:51<01:37,  1.60it/s, mae=120.42]Training:  38%|███▊      | 96/250 [01:51<01:35,  1.60it/s, mae=120.42]Training:  38%|███▊      | 96/250 [01:52<01:35,  1.60it/s, mae=120.31]Training:  39%|███▉      | 97/250 [01:52<01:35,  1.61it/s, mae=120.31]Training:  39%|███▉      | 97/250 [01:52<01:35,  1.61it/s, mae=120.21]Training:  39%|███▉      | 98/250 [01:52<01:34,  1.61it/s, mae=120.21]Training:  39%|███▉      | 98/250 [01:53<01:34,  1.61it/s, mae=120.06]Training:  40%|███▉      | 99/250 [01:53<01:33,  1.61it/s, mae=120.06]Training:  40%|███▉      | 99/250 [01:54<01:33,  1.61it/s, mae=119.93]Training:  40%|████      | 100/250 [01:54<01:34,  1.59it/s, mae=119.93]Training:  40%|████      | 100/250 [01:54<01:34,  1.59it/s, mae=119.84]Training:  40%|████      | 101/250 [01:54<01:33,  1.60it/s, mae=119.84]Training:  40%|████      | 101/250 [01:55<01:33,  1.60it/s, mae=119.69]Training:  41%|████      | 102/250 [01:55<01:32,  1.60it/s, mae=119.69]Training:  41%|████      | 102/250 [01:55<01:32,  1.60it/s, mae=119.47]Training:  41%|████      | 103/250 [01:55<01:32,  1.59it/s, mae=119.47]Training:  41%|████      | 103/250 [01:56<01:32,  1.59it/s, mae=119.44]Training:  42%|████▏     | 104/250 [01:56<01:31,  1.60it/s, mae=119.44]Training:  42%|████▏     | 104/250 [01:57<01:31,  1.60it/s, mae=119.35]Training:  42%|████▏     | 105/250 [01:57<01:30,  1.60it/s, mae=119.35]Training:  42%|████▏     | 105/250 [01:57<01:30,  1.60it/s, mae=119.19]Training:  42%|████▏     | 106/250 [01:57<01:29,  1.60it/s, mae=119.19]Training:  42%|████▏     | 106/250 [01:58<01:29,  1.60it/s, mae=119.08]Training:  43%|████▎     | 107/250 [01:58<01:29,  1.60it/s, mae=119.08]Training:  43%|████▎     | 107/250 [01:59<01:29,  1.60it/s, mae=118.91]Training:  43%|████▎     | 108/250 [01:59<01:28,  1.60it/s, mae=118.91]Training:  43%|████▎     | 108/250 [01:59<01:28,  1.60it/s, mae=118.85]Training:  44%|████▎     | 109/250 [01:59<01:27,  1.61it/s, mae=118.85]Training:  44%|████▎     | 109/250 [02:00<01:27,  1.61it/s, mae=118.74]Training:  44%|████▍     | 110/250 [02:00<01:27,  1.61it/s, mae=118.74]Training:  44%|████▍     | 110/250 [02:00<01:27,  1.61it/s, mae=118.74]Training:  44%|████▍     | 111/250 [02:00<01:26,  1.61it/s, mae=118.74]Training:  44%|████▍     | 111/250 [02:01<01:26,  1.61it/s, mae=118.64]Training:  45%|████▍     | 112/250 [02:01<01:25,  1.61it/s, mae=118.64]Training:  45%|████▍     | 112/250 [02:02<01:25,  1.61it/s, mae=118.56]Training:  45%|████▌     | 113/250 [02:02<01:25,  1.61it/s, mae=118.56]Training:  45%|████▌     | 113/250 [02:02<01:25,  1.61it/s, mae=118.46]Training:  46%|████▌     | 114/250 [02:02<01:24,  1.61it/s, mae=118.46]Training:  46%|████▌     | 114/250 [02:03<01:24,  1.61it/s, mae=118.36]Training:  46%|████▌     | 115/250 [02:03<01:23,  1.61it/s, mae=118.36]Training:  46%|████▌     | 115/250 [02:04<01:23,  1.61it/s, mae=118.37]Training:  46%|████▋     | 116/250 [02:04<01:23,  1.61it/s, mae=118.37]Training:  46%|████▋     | 116/250 [02:04<01:23,  1.61it/s, mae=118.31]Training:  47%|████▋     | 117/250 [02:04<01:24,  1.58it/s, mae=118.31]Training:  47%|████▋     | 117/250 [02:05<01:24,  1.58it/s, mae=118.34]Training:  47%|████▋     | 118/250 [02:05<01:22,  1.60it/s, mae=118.34]Training:  47%|████▋     | 118/250 [02:05<01:22,  1.60it/s, mae=118.12]Training:  48%|████▊     | 119/250 [02:05<01:21,  1.60it/s, mae=118.12]Training:  48%|████▊     | 119/250 [02:06<01:21,  1.60it/s, mae=118.11]Training:  48%|████▊     | 120/250 [02:06<01:20,  1.61it/s, mae=118.11]Training:  48%|████▊     | 120/250 [02:07<01:20,  1.61it/s, mae=117.94]Training:  48%|████▊     | 121/250 [02:07<01:20,  1.61it/s, mae=117.94]Training:  48%|████▊     | 121/250 [02:07<01:20,  1.61it/s, mae=117.72]Training:  49%|████▉     | 122/250 [02:07<01:19,  1.61it/s, mae=117.72]Training:  49%|████▉     | 122/250 [02:08<01:19,  1.61it/s, mae=117.59]Training:  49%|████▉     | 123/250 [02:08<01:18,  1.61it/s, mae=117.59]Training:  49%|████▉     | 123/250 [02:09<01:18,  1.61it/s, mae=117.55]Training:  50%|████▉     | 124/250 [02:09<01:18,  1.61it/s, mae=117.55]Training:  50%|████▉     | 124/250 [02:09<01:18,  1.61it/s, mae=117.41]Training:  50%|█████     | 125/250 [02:09<01:17,  1.61it/s, mae=117.41]Training:  50%|█████     | 125/250 [02:10<01:17,  1.61it/s, mae=117.26]Training:  50%|█████     | 126/250 [02:10<01:16,  1.61it/s, mae=117.26]Training:  50%|█████     | 126/250 [02:10<01:16,  1.61it/s, mae=117.18]Training:  51%|█████     | 127/250 [02:10<01:16,  1.61it/s, mae=117.18]Training:  51%|█████     | 127/250 [02:11<01:16,  1.61it/s, mae=117.16]Training:  51%|█████     | 128/250 [02:11<01:15,  1.61it/s, mae=117.16]Training:  51%|█████     | 128/250 [02:12<01:15,  1.61it/s, mae=117.02]Training:  52%|█████▏    | 129/250 [02:12<01:15,  1.61it/s, mae=117.02]Training:  52%|█████▏    | 129/250 [02:12<01:15,  1.61it/s, mae=116.87]Training:  52%|█████▏    | 130/250 [02:12<01:14,  1.61it/s, mae=116.87]Training:  52%|█████▏    | 130/250 [02:13<01:14,  1.61it/s, mae=116.77]Training:  52%|█████▏    | 131/250 [02:13<01:13,  1.61it/s, mae=116.77]Training:  52%|█████▏    | 131/250 [02:14<01:13,  1.61it/s, mae=116.68]Training:  53%|█████▎    | 132/250 [02:14<01:13,  1.61it/s, mae=116.68]Training:  53%|█████▎    | 132/250 [02:14<01:13,  1.61it/s, mae=116.55]Training:  53%|█████▎    | 133/250 [02:14<01:12,  1.61it/s, mae=116.55]Training:  53%|█████▎    | 133/250 [02:15<01:12,  1.61it/s, mae=116.43]Training:  54%|█████▎    | 134/250 [02:15<01:11,  1.61it/s, mae=116.43]Training:  54%|█████▎    | 134/250 [02:15<01:11,  1.61it/s, mae=116.26]Training:  54%|█████▍    | 135/250 [02:15<01:11,  1.61it/s, mae=116.26]Training:  54%|█████▍    | 135/250 [02:16<01:11,  1.61it/s, mae=116.09]Training:  54%|█████▍    | 136/250 [02:16<01:10,  1.61it/s, mae=116.09]Training:  54%|█████▍    | 136/250 [02:17<01:10,  1.61it/s, mae=116.00]Training:  55%|█████▍    | 137/250 [02:17<01:10,  1.61it/s, mae=116.00]Training:  55%|█████▍    | 137/250 [02:17<01:10,  1.61it/s, mae=115.92]Training:  55%|█████▌    | 138/250 [02:17<01:09,  1.61it/s, mae=115.92]Training:  55%|█████▌    | 138/250 [02:18<01:09,  1.61it/s, mae=115.81]Training:  56%|█████▌    | 139/250 [02:18<01:08,  1.61it/s, mae=115.81]Training:  56%|█████▌    | 139/250 [02:18<01:08,  1.61it/s, mae=115.72]Training:  56%|█████▌    | 140/250 [02:18<01:09,  1.59it/s, mae=115.72]Training:  56%|█████▌    | 140/250 [02:19<01:09,  1.59it/s, mae=115.65]Training:  56%|█████▋    | 141/250 [02:19<01:08,  1.59it/s, mae=115.65]Training:  56%|█████▋    | 141/250 [02:20<01:08,  1.59it/s, mae=115.53]Training:  57%|█████▋    | 142/250 [02:20<01:07,  1.60it/s, mae=115.53]Training:  57%|█████▋    | 142/250 [02:20<01:07,  1.60it/s, mae=115.45]Training:  57%|█████▋    | 143/250 [02:20<01:06,  1.60it/s, mae=115.45]Training:  57%|█████▋    | 143/250 [02:21<01:06,  1.60it/s, mae=115.45]Training:  58%|█████▊    | 144/250 [02:21<01:06,  1.61it/s, mae=115.45]Training:  58%|█████▊    | 144/250 [02:22<01:06,  1.61it/s, mae=115.39]Training:  58%|█████▊    | 145/250 [02:22<01:06,  1.59it/s, mae=115.39]Training:  58%|█████▊    | 145/250 [02:22<01:06,  1.59it/s, mae=115.26]Training:  58%|█████▊    | 146/250 [02:22<01:05,  1.59it/s, mae=115.26]Training:  58%|█████▊    | 146/250 [02:23<01:05,  1.59it/s, mae=115.17]Training:  59%|█████▉    | 147/250 [02:23<01:04,  1.60it/s, mae=115.17]Training:  59%|█████▉    | 147/250 [02:23<01:04,  1.60it/s, mae=115.09]Training:  59%|█████▉    | 148/250 [02:23<01:03,  1.60it/s, mae=115.09]Training:  59%|█████▉    | 148/250 [02:24<01:03,  1.60it/s, mae=115.00]Training:  60%|█████▉    | 149/250 [02:24<01:02,  1.61it/s, mae=115.00]Training:  60%|█████▉    | 149/250 [02:25<01:02,  1.61it/s, mae=114.89]Training:  60%|██████    | 150/250 [02:25<01:02,  1.61it/s, mae=114.89]Training:  60%|██████    | 150/250 [02:25<01:02,  1.61it/s, mae=114.78]Training:  60%|██████    | 151/250 [02:25<01:01,  1.61it/s, mae=114.78]Training:  60%|██████    | 151/250 [02:26<01:01,  1.61it/s, mae=114.65]Training:  61%|██████    | 152/250 [02:26<01:00,  1.61it/s, mae=114.65]Training:  61%|██████    | 152/250 [02:27<01:00,  1.61it/s, mae=114.65]Training:  61%|██████    | 153/250 [02:27<01:00,  1.61it/s, mae=114.65]Training:  61%|██████    | 153/250 [02:27<01:00,  1.61it/s, mae=114.60]Training:  62%|██████▏   | 154/250 [02:27<00:59,  1.61it/s, m