Training:   0%|          | 0/250 [00:00<?, ?it/s]Training:   0%|          | 0/250 [00:02<?, ?it/s, mae=128.32]Training:   0%|          | 1/250 [00:02<11:53,  2.87s/it, mae=128.32]Training:   0%|          | 1/250 [00:03<11:53,  2.87s/it, mae=128.41]Training:   1%|          | 2/250 [00:03<06:30,  1.58s/it, mae=128.41]Training:   1%|          | 2/250 [00:04<06:30,  1.58s/it, mae=127.47]Training:   1%|          | 3/250 [00:04<04:52,  1.18s/it, mae=127.47]Training:   1%|          | 3/250 [00:04<04:52,  1.18s/it, mae=130.60]Training:   2%|▏         | 4/250 [00:04<03:55,  1.05it/s, mae=130.60]Training:   2%|▏         | 4/250 [00:05<03:55,  1.05it/s, mae=129.88]Training:   2%|▏         | 5/250 [00:05<03:24,  1.20it/s, mae=129.88]Training:   2%|▏         | 5/250 [00:06<03:24,  1.20it/s, mae=128.64]Training:   2%|▏         | 6/250 [00:06<03:05,  1.31it/s, mae=128.64]Training:   2%|▏         | 6/250 [00:06<03:05,  1.31it/s, mae=128.10]Training:   3%|▎         | 7/250 [00:06<02:54,  1.40it/s, mae=128.10]Training:   3%|▎         | 7/250 [00:07<02:54,  1.40it/s, mae=128.50]Training:   3%|▎         | 8/250 [00:07<02:45,  1.46it/s, mae=128.50]Training:   3%|▎         | 8/250 [00:07<02:45,  1.46it/s, mae=129.13]Training:   4%|▎         | 9/250 [00:07<02:41,  1.50it/s, mae=129.13]Training:   4%|▎         | 9/250 [00:08<02:41,  1.50it/s, mae=128.20]Training:   4%|▍         | 10/250 [00:08<02:36,  1.53it/s, mae=128.20]Training:   4%|▍         | 10/250 [00:09<02:36,  1.53it/s, mae=128.98]Training:   4%|▍         | 11/250 [00:09<02:33,  1.56it/s, mae=128.98]Training:   4%|▍         | 11/250 [00:09<02:33,  1.56it/s, mae=128.52]Training:   5%|▍         | 12/250 [00:09<02:31,  1.57it/s, mae=128.52]Training:   5%|▍         | 12/250 [00:10<02:31,  1.57it/s, mae=127.57]Training:   5%|▌         | 13/250 [00:10<02:33,  1.55it/s, mae=127.57]Training:   5%|▌         | 13/250 [00:11<02:33,  1.55it/s, mae=127.61]Training:   6%|▌         | 14/250 [00:11<02:29,  1.57it/s, mae=127.61]Training:   6%|▌         | 14/250 [00:11<02:29,  1.57it/s, mae=127.49]Training:   6%|▌         | 15/250 [00:11<02:28,  1.58it/s, mae=127.49]Training:   6%|▌         | 15/250 [00:12<02:28,  1.58it/s, mae=127.63]Training:   6%|▋         | 16/250 [00:12<02:29,  1.56it/s, mae=127.63]Training:   6%|▋         | 16/250 [00:13<02:29,  1.56it/s, mae=127.42]Training:   7%|▋         | 17/250 [00:13<02:27,  1.58it/s, mae=127.42]Training:   7%|▋         | 17/250 [00:13<02:27,  1.58it/s, mae=127.72]Training:   7%|▋         | 18/250 [00:13<02:32,  1.52it/s, mae=127.72]Training:   7%|▋         | 18/250 [00:14<02:32,  1.52it/s, mae=127.65]Training:   8%|▊         | 19/250 [00:14<02:28,  1.56it/s, mae=127.65]Training:   8%|▊         | 19/250 [00:14<02:28,  1.56it/s, mae=128.17]Training:   8%|▊         | 20/250 [00:14<02:26,  1.57it/s, mae=128.17]Training:   8%|▊         | 20/250 [00:15<02:26,  1.57it/s, mae=128.31]Training:   8%|▊         | 21/250 [00:15<02:24,  1.59it/s, mae=128.31]Training:   8%|▊         | 21/250 [00:16<02:24,  1.59it/s, mae=128.19]Training:   9%|▉         | 22/250 [00:16<02:23,  1.59it/s, mae=128.19]Training:   9%|▉         | 22/250 [00:16<02:23,  1.59it/s, mae=128.16]Training:   9%|▉         | 23/250 [00:16<02:22,  1.60it/s, mae=128.16]Training:   9%|▉         | 23/250 [00:17<02:22,  1.60it/s, mae=128.14]Training:  10%|▉         | 24/250 [00:17<02:24,  1.56it/s, mae=128.14]Training:  10%|▉         | 24/250 [00:18<02:24,  1.56it/s, mae=128.14]Training:  10%|█         | 25/250 [00:18<02:21,  1.59it/s, mae=128.14]Training:  10%|█         | 25/250 [00:18<02:21,  1.59it/s, mae=127.88]Training:  10%|█         | 26/250 [00:18<02:20,  1.59it/s, mae=127.88]Training:  10%|█         | 26/250 [00:19<02:20,  1.59it/s, mae=127.44]Training:  11%|█         | 27/250 [00:19<02:19,  1.60it/s, mae=127.44]Training:  11%|█         | 27/250 [00:19<02:19,  1.60it/s, mae=127.44]Training:  11%|█         | 28/250 [00:19<02:18,  1.60it/s, mae=127.44]Training:  11%|█         | 28/250 [00:20<02:18,  1.60it/s, mae=127.32]Training:  12%|█▏        | 29/250 [00:20<02:17,  1.60it/s, mae=127.32]Training:  12%|█▏        | 29/250 [00:21<02:17,  1.60it/s, mae=126.70]Training:  12%|█▏        | 30/250 [00:21<02:17,  1.60it/s, mae=126.70]Training:  12%|█▏        | 30/250 [00:21<02:17,  1.60it/s, mae=126.54]Training:  12%|█▏        | 31/250 [00:21<02:17,  1.59it/s, mae=126.54]Training:  12%|█▏        | 31/250 [00:22<02:17,  1.59it/s, mae=126.19]Training:  13%|█▎        | 32/250 [00:22<02:16,  1.60it/s, mae=126.19]Training:  13%|█▎        | 32/250 [00:23<02:16,  1.60it/s, mae=126.40]Training:  13%|█▎        | 33/250 [00:23<02:15,  1.60it/s, mae=126.40]Training:  13%|█▎        | 33/250 [00:23<02:15,  1.60it/s, mae=126.52]Training:  14%|█▎        | 34/250 [00:23<02:14,  1.60it/s, mae=126.52]Training:  14%|█▎        | 34/250 [00:24<02:14,  1.60it/s, mae=126.71]Training:  14%|█▍        | 35/250 [00:24<02:14,  1.60it/s, mae=126.71]Training:  14%|█▍        | 35/250 [00:24<02:14,  1.60it/s, mae=126.49]Training:  14%|█▍        | 36/250 [00:24<02:13,  1.60it/s, mae=126.49]Training:  14%|█▍        | 36/250 [00:25<02:13,  1.60it/s, mae=126.21]Training:  15%|█▍        | 37/250 [00:25<02:12,  1.61it/s, mae=126.21]Training:  15%|█▍        | 37/250 [00:26<02:12,  1.61it/s, mae=126.40]Training:  15%|█▌        | 38/250 [00:26<02:11,  1.61it/s, mae=126.40]Training:  15%|█▌        | 38/250 [00:26<02:11,  1.61it/s, mae=125.96]Training:  16%|█▌        | 39/250 [00:26<02:11,  1.61it/s, mae=125.96]Training:  16%|█▌        | 39/250 [00:27<02:11,  1.61it/s, mae=125.78]Training:  16%|█▌        | 40/250 [00:27<02:10,  1.61it/s, mae=125.78]Training:  16%|█▌        | 40/250 [00:28<02:10,  1.61it/s, mae=125.41]Training:  16%|█▋        | 41/250 [00:28<02:10,  1.61it/s, mae=125.41]Training:  16%|█▋        | 41/250 [00:28<02:10,  1.61it/s, mae=125.22]Training:  17%|█▋        | 42/250 [00:28<02:10,  1.59it/s, mae=125.22]Training:  17%|█▋        | 42/250 [00:29<02:10,  1.59it/s, mae=125.09]Training:  17%|█▋        | 43/250 [00:29<02:09,  1.59it/s, mae=125.09]Training:  17%|█▋        | 43/250 [00:29<02:09,  1.59it/s, mae=125.37]Training:  18%|█▊        | 44/250 [00:29<02:08,  1.60it/s, mae=125.37]Training:  18%|█▊        | 44/250 [00:30<02:08,  1.60it/s, mae=125.49]Training:  18%|█▊        | 45/250 [00:30<02:07,  1.60it/s, mae=125.49]Training:  18%|█▊        | 45/250 [00:31<02:07,  1.60it/s, mae=125.72]Training:  18%|█▊        | 46/250 [00:31<02:10,  1.57it/s, mae=125.72]Training:  18%|█▊        | 46/250 [00:31<02:10,  1.57it/s, mae=125.77]Training:  19%|█▉        | 47/250 [00:31<02:08,  1.57it/s, mae=125.77]Training:  19%|█▉        | 47/250 [00:32<02:08,  1.57it/s, mae=125.49]Training:  19%|█▉        | 48/250 [00:32<02:07,  1.59it/s, mae=125.49]Training:  19%|█▉        | 48/250 [00:33<02:07,  1.59it/s, mae=125.47]Training:  20%|█▉        | 49/250 [00:33<02:06,  1.59it/s, mae=125.47]Training:  20%|█▉        | 49/250 [00:33<02:06,  1.59it/s, mae=125.61]Training:  20%|██        | 50/250 [00:33<02:05,  1.60it/s, mae=125.61]Training:  20%|██        | 50/250 [00:34<02:05,  1.60it/s, mae=125.69]Training:  20%|██        | 51/250 [00:34<02:04,  1.60it/s, mae=125.69]Training:  20%|██        | 51/250 [00:34<02:04,  1.60it/s, mae=125.43]Training:  21%|██        | 52/250 [00:34<02:04,  1.59it/s, mae=125.43]Training:  21%|██        | 52/250 [00:35<02:04,  1.59it/s, mae=125.42]Training:  21%|██        | 53/250 [00:35<02:03,  1.60it/s, mae=125.42]Training:  21%|██        | 53/250 [00:36<02:03,  1.60it/s, mae=125.53]Training:  22%|██▏       | 54/250 [00:36<02:02,  1.60it/s, mae=125.53]Training:  22%|██▏       | 54/250 [00:36<02:02,  1.60it/s, mae=125.36]Training:  22%|██▏       | 55/250 [00:36<02:01,  1.60it/s, mae=125.36]Training:  22%|██▏       | 55/250 [00:37<02:01,  1.60it/s, mae=125.36]Training:  22%|██▏       | 56/250 [00:37<02:01,  1.60it/s, mae=125.36]Training:  22%|██▏       | 56/250 [00:38<02:01,  1.60it/s, mae=125.51]Training:  23%|██▎       | 57/250 [00:38<02:02,  1.57it/s, mae=125.51]Training:  23%|██▎       | 57/250 [00:38<02:02,  1.57it/s, mae=125.45]Training:  23%|██▎       | 58/250 [00:38<02:01,  1.58it/s, mae=125.45]Training:  23%|██▎       | 58/250 [00:39<02:01,  1.58it/s, mae=125.49]Training:  24%|██▎       | 59/250 [00:39<01:59,  1.59it/s, mae=125.49]Training:  24%|██▎       | 59/250 [00:40<01:59,  1.59it/s, mae=125.28]Training:  24%|██▍       | 60/250 [00:40<01:59,  1.59it/s, mae=125.28]Training:  24%|██▍       | 60/250 [00:40<01:59,  1.59it/s, mae=125.05]Training:  24%|██▍       | 61/250 [00:40<01:58,  1.60it/s, mae=125.05]Training:  24%|██▍       | 61/250 [00:41<01:58,  1.60it/s, mae=124.96]Training:  25%|██▍       | 62/250 [00:41<01:57,  1.60it/s, mae=124.96]Training:  25%|██▍       | 62/250 [00:41<01:57,  1.60it/s, mae=124.90]Training:  25%|██▌       | 63/250 [00:41<01:56,  1.60it/s, mae=124.90]Training:  25%|██▌       | 63/250 [00:42<01:56,  1.60it/s, mae=124.80]Training:  26%|██▌       | 64/250 [00:42<01:56,  1.59it/s, mae=124.80]Training:  26%|██▌       | 64/250 [00:43<01:56,  1.59it/s, mae=124.72]Training:  26%|██▌       | 65/250 [00:43<01:56,  1.59it/s, mae=124.72]Training:  26%|██▌       | 65/250 [00:43<01:56,  1.59it/s, mae=124.65]Training:  26%|██▋       | 66/250 [00:43<01:55,  1.60it/s, mae=124.65]Training:  26%|██▋       | 66/250 [00:44<01:55,  1.60it/s, mae=124.55]Training:  27%|██▋       | 67/250 [00:44<01:54,  1.60it/s, mae=124.55]Training:  27%|██▋       | 67/250 [00:45<01:54,  1.60it/s, mae=124.35]Training:  27%|██▋       | 68/250 [00:45<01:53,  1.60it/s, mae=124.35]Training:  27%|██▋       | 68/250 [00:45<01:53,  1.60it/s, mae=124.49]Training:  28%|██▊       | 69/250 [00:45<01:52,  1.60it/s, mae=124.49]Training:  28%|██▊       | 69/250 [00:46<01:52,  1.60it/s, mae=124.29]Training:  28%|██▊       | 70/250 [00:46<01:52,  1.60it/s, mae=124.29]Training:  28%|██▊       | 70/250 [00:46<01:52,  1.60it/s, mae=124.18]Training:  28%|██▊       | 71/250 [00:46<01:51,  1.61it/s, mae=124.18]Training:  28%|██▊       | 71/250 [00:47<01:51,  1.61it/s, mae=124.03]Training:  29%|██▉       | 72/250 [00:47<01:50,  1.60it/s, mae=124.03]Training:  29%|██▉       | 72/250 [00:48<01:50,  1.60it/s, mae=123.87]Training:  29%|██▉       | 73/250 [00:48<01:50,  1.60it/s, mae=123.87]Training:  29%|██▉       | 73/250 [00:48<01:50,  1.60it/s, mae=123.78]Training:  30%|██▉       | 74/250 [00:48<01:49,  1.60it/s, mae=123.78]Training:  30%|██▉       | 74/250 [00:49<01:49,  1.60it/s, mae=123.70]Training:  30%|███       | 75/250 [00:49<01:49,  1.61it/s, mae=123.70]Training:  30%|███       | 75/250 [00:49<01:49,  1.61it/s, mae=123.57]Training:  30%|███       | 76/250 [00:49<01:48,  1.61it/s, mae=123.57]Training:  30%|███       | 76/250 [00:50<01:48,  1.61it/s, mae=123.45]Training:  31%|███       | 77/250 [00:50<01:47,  1.60it/s, mae=123.45]Training:  31%|███       | 77/250 [00:51<01:47,  1.60it/s, mae=123.44]Training:  31%|███       | 78/250 [00:51<01:47,  1.60it/s, mae=123.44]Training:  31%|███       | 78/250 [00:51<01:47,  1.60it/s, mae=123.31]Training:  32%|███▏      | 79/250 [00:51<01:46,  1.60it/s, mae=123.31]Training:  32%|███▏      | 79/250 [00:52<01:46,  1.60it/s, mae=123.28]Training:  32%|███▏      | 80/250 [00:52<01:46,  1.60it/s, mae=123.28]Training:  32%|███▏      | 80/250 [00:53<01:46,  1.60it/s, mae=123.25]Training:  32%|███▏      | 81/250 [00:53<01:45,  1.61it/s, mae=123.25]Training:  32%|███▏      | 81/250 [00:53<01:45,  1.61it/s, mae=123.17]Training:  33%|███▎      | 82/250 [00:53<01:44,  1.60it/s, mae=123.17]Training:  33%|███▎      | 82/250 [00:54<01:44,  1.60it/s, mae=123.10]Training:  33%|███▎      | 83/250 [00:54<01:44,  1.60it/s, mae=123.10]Training:  33%|███▎      | 83/250 [00:54<01:44,  1.60it/s, mae=122.97]Training:  34%|███▎      | 84/250 [00:54<01:43,  1.61it/s, mae=122.97]Training:  34%|███▎      | 84/250 [00:55<01:43,  1.61it/s, mae=122.66]Training:  34%|███▍      | 85/250 [00:55<01:44,  1.57it/s, mae=122.66]Training:  34%|███▍      | 85/250 [00:56<01:44,  1.57it/s, mae=122.67]Training:  34%|███▍      | 86/250 [00:56<01:44,  1.56it/s, mae=122.67]Training:  34%|███▍      | 86/250 [00:56<01:44,  1.56it/s, mae=122.67]Training:  35%|███▍      | 87/250 [00:56<01:42,  1.59it/s, mae=122.67]Training:  35%|███▍      | 87/250 [00:57<01:42,  1.59it/s, mae=122.54]Training:  35%|███▌      | 88/250 [00:57<01:41,  1.59it/s, mae=122.54]Training:  35%|███▌      | 88/250 [00:58<01:41,  1.59it/s, mae=122.44]Training:  36%|███▌      | 89/250 [00:58<01:40,  1.60it/s, mae=122.44]Training:  36%|███▌      | 89/250 [00:58<01:40,  1.60it/s, mae=122.31]Training:  36%|███▌      | 90/250 [00:58<01:40,  1.60it/s, mae=122.31]Training:  36%|███▌      | 90/250 [00:59<01:40,  1.60it/s, mae=122.30]Training:  36%|███▋      | 91/250 [00:59<01:39,  1.60it/s, mae=122.30]Training:  36%|███▋      | 91/250 [01:00<01:39,  1.60it/s, mae=122.31]Training:  37%|███▋      | 92/250 [01:00<01:39,  1.59it/s, mae=122.31]Training:  37%|███▋      | 92/250 [01:00<01:39,  1.59it/s, mae=122.30]Training:  37%|███▋      | 93/250 [01:00<01:38,  1.59it/s, mae=122.30]Training:  37%|███▋      | 93/250 [01:01<01:38,  1.59it/s, mae=122.34]Training:  38%|███▊      | 94/250 [01:01<01:37,  1.60it/s, mae=122.34]Training:  38%|███▊      | 94/250 [01:01<01:37,  1.60it/s, mae=122.33]Training:  38%|███▊      | 95/250 [01:01<01:36,  1.60it/s, mae=122.33]Training:  38%|███▊      | 95/250 [01:02<01:36,  1.60it/s, mae=122.34]Training:  38%|███▊      | 96/250 [01:02<01:36,  1.60it/s, mae=122.34]Training:  38%|███▊      | 96/250 [01:03<01:36,  1.60it/s, mae=122.28]Training:  39%|███▉      | 97/250 [01:03<01:37,  1.57it/s, mae=122.28]Training:  39%|███▉      | 97/250 [01:03<01:37,  1.57it/s, mae=122.02]Training:  39%|███▉      | 98/250 [01:03<01:35,  1.59it/s, mae=122.02]Training:  39%|███▉      | 98/250 [01:04<01:35,  1.59it/s, mae=121.90]Training:  40%|███▉      | 99/250 [01:04<01:34,  1.59it/s, mae=121.90]Training:  40%|███▉      | 99/250 [01:05<01:34,  1.59it/s, mae=121.86]Training:  40%|████      | 100/250 [01:05<01:33,  1.60it/s, mae=121.86]Training:  40%|████      | 100/250 [01:05<01:33,  1.60it/s, mae=121.76]Training:  40%|████      | 101/250 [01:05<01:33,  1.60it/s, mae=121.76]Training:  40%|████      | 101/250 [01:06<01:33,  1.60it/s, mae=121.65]Training:  41%|████      | 102/250 [01:06<01:32,  1.60it/s, mae=121.65]Training:  41%|████      | 102/250 [01:06<01:32,  1.60it/s, mae=121.65]Training:  41%|████      | 103/250 [01:06<01:33,  1.58it/s, mae=121.65]Training:  41%|████      | 103/250 [01:07<01:33,  1.58it/s, mae=121.52]Training:  42%|████▏     | 104/250 [01:07<01:32,  1.57it/s, mae=121.52]Training:  42%|████▏     | 104/250 [01:08<01:32,  1.57it/s, mae=121.39]Training:  42%|████▏     | 105/250 [01:08<01:31,  1.59it/s, mae=121.39]Training:  42%|████▏     | 105/250 [01:08<01:31,  1.59it/s, mae=121.43]Training:  42%|████▏     | 106/250 [01:08<01:31,  1.57it/s, mae=121.43]Training:  42%|████▏     | 106/250 [01:09<01:31,  1.57it/s, mae=121.31]Training:  43%|████▎     | 107/250 [01:09<01:30,  1.59it/s, mae=121.31]Training:  43%|████▎     | 107/250 [01:10<01:30,  1.59it/s, mae=121.27]Training:  43%|████▎     | 108/250 [01:10<01:29,  1.59it/s, mae=121.27]Training:  43%|████▎     | 108/250 [01:10<01:29,  1.59it/s, mae=121.16]Training:  44%|████▎     | 109/250 [01:10<01:28,  1.60it/s, mae=121.16]Training:  44%|████▎     | 109/250 [01:11<01:28,  1.60it/s, mae=121.05]Training:  44%|████▍     | 110/250 [01:11<01:27,  1.60it/s, mae=121.05]Training:  44%|████▍     | 110/250 [01:12<01:27,  1.60it/s, mae=121.05]Training:  44%|████▍     | 111/250 [01:12<01:28,  1.58it/s, mae=121.05]Training:  44%|████▍     | 111/250 [01:12<01:28,  1.58it/s, mae=121.04]Training:  45%|████▍     | 112/250 [01:12<01:27,  1.58it/s, mae=121.04]Training:  45%|████▍     | 112/250 [01:13<01:27,  1.58it/s, mae=120.94]Training:  45%|████▌     | 113/250 [01:13<01:26,  1.59it/s, mae=120.94]Training:  45%|████▌     | 113/250 [01:13<01:26,  1.59it/s, mae=120.80]Training:  46%|████▌     | 114/250 [01:13<01:25,  1.59it/s, mae=120.80]Training:  46%|████▌     | 114/250 [01:14<01:25,  1.59it/s, mae=120.71]Training:  46%|████▌     | 115/250 [01:14<01:24,  1.60it/s, mae=120.71]Training:  46%|████▌     | 115/250 [01:15<01:24,  1.60it/s, mae=120.69]Training:  46%|████▋     | 116/250 [01:15<01:23,  1.60it/s, mae=120.69]Training:  46%|████▋     | 116/250 [01:15<01:23,  1.60it/s, mae=120.61]Training:  47%|████▋     | 117/250 [01:15<01:23,  1.60it/s, mae=120.61]Training:  47%|████▋     | 117/250 [01:16<01:23,  1.60it/s, mae=120.61]Training:  47%|████▋     | 118/250 [01:16<01:22,  1.60it/s, mae=120.61]Training:  47%|████▋     | 118/250 [01:16<01:22,  1.60it/s, mae=120.55]Training:  48%|████▊     | 119/250 [01:16<01:21,  1.60it/s, mae=120.55]Training:  48%|████▊     | 119/250 [01:17<01:21,  1.60it/s, mae=120.44]Training:  48%|████▊     | 120/250 [01:17<01:21,  1.60it/s, mae=120.44]Training:  48%|████▊     | 120/250 [01:18<01:21,  1.60it/s, mae=120.32]Training:  48%|████▊     | 121/250 [01:18<01:21,  1.58it/s, mae=120.32]Training:  48%|████▊     | 121/250 [01:18<01:21,  1.58it/s, mae=120.17]Training:  49%|████▉     | 122/250 [01:18<01:20,  1.59it/s, mae=120.17]Training:  49%|████▉     | 122/250 [01:19<01:20,  1.59it/s, mae=120.12]Training:  49%|████▉     | 123/250 [01:19<01:19,  1.59it/s, mae=120.12]Training:  49%|████▉     | 123/250 [01:20<01:19,  1.59it/s, mae=120.14]Training:  50%|████▉     | 124/250 [01:20<01:18,  1.60it/s, mae=120.14]Training:  50%|████▉     | 124/250 [01:20<01:18,  1.60it/s, mae=119.92]Training:  50%|█████     | 125/250 [01:20<01:18,  1.60it/s, mae=119.92]Training:  50%|█████     | 125/250 [01:21<01:18,  1.60it/s, mae=119.73]Training:  50%|█████     | 126/250 [01:21<01:17,  1.60it/s, mae=119.73]Training:  50%|█████     | 126/250 [01:22<01:17,  1.60it/s, mae=119.71]Training:  51%|█████     | 127/250 [01:22<01:16,  1.60it/s, mae=119.71]Training:  51%|█████     | 127/250 [01:22<01:16,  1.60it/s, mae=119.62]Training:  51%|█████     | 128/250 [01:22<01:16,  1.60it/s, mae=119.62]Training:  51%|█████     | 128/250 [01:23<01:16,  1.60it/s, mae=119.60]Training:  52%|█████▏    | 129/250 [01:23<01:15,  1.60it/s, mae=119.60]Training:  52%|█████▏    | 129/250 [01:23<01:15,  1.60it/s, mae=119.58]Training:  52%|█████▏    | 130/250 [01:23<01:14,  1.60it/s, mae=119.58]Training:  52%|█████▏    | 130/250 [01:24<01:14,  1.60it/s, mae=119.49]Training:  52%|█████▏    | 131/250 [01:24<01:14,  1.60it/s, mae=119.49]Training:  52%|█████▏    | 131/250 [01:25<01:14,  1.60it/s, mae=119.41]Training:  53%|█████▎    | 132/250 [01:25<01:13,  1.61it/s, mae=119.41]Training:  53%|█████▎    | 132/250 [01:25<01:13,  1.61it/s, mae=119.45]Training:  53%|█████▎    | 133/250 [01:25<01:12,  1.60it/s, mae=119.45]Training:  53%|█████▎    | 133/250 [01:26<01:12,  1.60it/s, mae=119.32]Training:  54%|█████▎    | 134/250 [01:26<01:12,  1.61it/s, mae=119.32]Training:  54%|█████▎    | 134/250 [01:26<01:12,  1.61it/s, mae=119.31]Training:  54%|█████▍    | 135/250 [01:26<01:11,  1.60it/s, mae=119.31]Training:  54%|█████▍    | 135/250 [01:27<01:11,  1.60it/s, mae=119.24]Training:  54%|█████▍    | 136/250 [01:27<01:11,  1.60it/s, mae=119.24]Training:  54%|█████▍    | 136/250 [01:28<01:11,  1.60it/s, mae=119.16]Training:  55%|█████▍    | 137/250 [01:28<01:10,  1.60it/s, mae=119.16]Training:  55%|█████▍    | 137/250 [01:28<01:10,  1.60it/s, mae=118.98]Training:  55%|█████▌    | 138/250 [01:28<01:09,  1.60it/s, mae=118.98]Training:  55%|█████▌    | 138/250 [01:29<01:09,  1.60it/s, mae=118.90]Training:  56%|█████▌    | 139/250 [01:29<01:09,  1.61it/s, mae=118.90]Training:  56%|█████▌    | 139/250 [01:30<01:09,  1.61it/s, mae=118.77]Training:  56%|█████▌    | 140/250 [01:30<01:08,  1.61it/s, mae=118.77]Training:  56%|█████▌    | 140/250 [01:30<01:08,  1.61it/s, mae=118.60]Training:  56%|█████▋    | 141/250 [01:30<01:07,  1.60it/s, mae=118.60]Training:  56%|█████▋    | 141/250 [01:31<01:07,  1.60it/s, mae=118.54]Training:  57%|█████▋    | 142/250 [01:31<01:07,  1.60it/s, mae=118.54]Training:  57%|█████▋    | 142/250 [01:31<01:07,  1.60it/s, mae=118.54]Training:  57%|█████▋    | 143/250 [01:31<01:06,  1.60it/s, mae=118.54]Training:  57%|█████▋    | 143/250 [01:32<01:06,  1.60it/s, mae=118.45]Training:  58%|█████▊    | 144/250 [01:32<01:06,  1.60it/s, mae=118.45]Training:  58%|█████▊    | 144/250 [01:33<01:06,  1.60it/s, mae=118.43]Training:  58%|█████▊    | 145/250 [01:33<01:06,  1.58it/s, mae=118.43]Training:  58%|█████▊    | 145/250 [01:33<01:06,  1.58it/s, mae=118.28]Training:  58%|█████▊    | 146/250 [01:33<01:05,  1.59it/s, mae=118.28]Training:  58%|█████▊    | 146/250 [01:34<01:05,  1.59it/s, mae=118.27]Training:  59%|█████▉    | 147/250 [01:34<01:04,  1.59it/s, mae=118.27]Training:  59%|█████▉    | 147/250 [01:35<01:04,  1.59it/s, mae=118.18]Training:  59%|█████▉    | 148/250 [01:35<01:03,  1.60it/s, mae=118.18]Training:  59%|█████▉    | 148/250 [01:35<01:03,  1.60it/s, mae=118.18]Training:  60%|█████▉    | 149/250 [01:35<01:03,  1.60it/s, mae=118.18]Training:  60%|█████▉    | 149/250 [01:36<01:03,  1.60it/s, mae=118.11]Training:  60%|██████    | 150/250 [01:36<01:02,  1.60it/s, mae=118.11]Training:  60%|██████    | 150/250 [01:36<01:02,  1.60it/s, mae=117.93]Training:  60%|██████    | 151/250 [01:36<01:01,  1.61it/s, mae=117.93]Training:  60%|██████    | 151/250 [01:37<01:01,  1.61it/s, mae=117.87]Training:  61%|██████    | 152/250 [01:37<01:01,  1.60it/s, mae=117.87]Training:  61%|██████    | 152/250 [01:38<01:01,  1.60it/s, mae=117.79]Training:  61%|██████    | 153/250 [01:38<01:00,  1.60it/s, mae=117.79]Training:  61%|██████    | 153/250 [01:38<01:00,  1.60it/s, mae=117.71]Training:  62%|██████▏   | 154/250 [01:38<00:59,  1.60it/s, mae=117.71]