
Currently Loaded Modules:
  1) GCCcore/12.3.0                        8) SQLite/3.42.0-GCCcore-12.3.0
  2) binutils/2.40-GCCcore-12.3.0          9) XZ/5.4.2-GCCcore-12.3.0
  3) bzip2/1.0.8-GCCcore-12.3.0           10) libffi/3.4.4-GCCcore-12.3.0
  4) ncurses/.6.4-GCCcore-12.3.0     (H)  11) OpenSSL/1.1
  5) libreadline/.8.2-GCCcore-12.3.0 (H)  12) Python/3.11.3-GCCcore-12.3.0
  6) zlib/.1.2.13-GCCcore-12.3.0     (H)  13) CUDA/12.6.0
  7) Tcl/.8.6.13-GCCcore-12.3.0      (H)

  Where:
   H:  Hidden Module

 

[I 2026-05-08 22:32:54,332] A new study created in RDB with name: hpo_convnextv2_tiny_boneage_HPOV1
