Training:   0%|          | 0/200 [00:00<?, ?it/s]Training:   0%|          | 0/200 [00:35<?, ?it/s, mae=140.22]Training:   0%|          | 1/200 [00:35<1:56:51, 35.24s/it, mae=140.22]Training:   0%|          | 1/200 [00:35<1:56:51, 35.24s/it, mae=137.51]Training:   1%|          | 2/200 [00:35<48:59, 14.85s/it, mae=137.51]  Training:   1%|          | 2/200 [00:36<48:59, 14.85s/it, mae=136.28]Training:   2%|▏         | 3/200 [00:36<27:16,  8.31s/it, mae=136.28]Training:   2%|▏         | 3/200 [00:36<27:16,  8.31s/it, mae=131.38]Training:   2%|▏         | 4/200 [00:36<17:05,  5.23s/it, mae=131.38]Training:   2%|▏         | 4/200 [00:37<17:05,  5.23s/it, mae=130.74]Training:   2%|▎         | 5/200 [00:37<11:30,  3.54s/it, mae=130.74]Training:   2%|▎         | 5/200 [00:37<11:30,  3.54s/it, mae=130.64]Training:   3%|▎         | 6/200 [00:37<08:07,  2.51s/it, mae=130.64]Training:   3%|▎         | 6/200 [00:38<08:07,  2.51s/it, mae=129.41]Training:   4%|▎         | 7/200 [00:38<05:59,  1.86s/it, mae=129.41]Training:   4%|▎         | 7/200 [00:38<05:59,  1.86s/it, mae=129.31]Training:   4%|▍         | 8/200 [00:38<04:37,  1.44s/it, mae=129.31]Training:   4%|▍         | 8/200 [00:39<04:37,  1.44s/it, mae=129.91]Training:   4%|▍         | 9/200 [00:39<03:40,  1.16s/it, mae=129.91]Training:   4%|▍         | 9/200 [00:40<03:40,  1.16s/it, mae=129.19]Training:   5%|▌         | 10/200 [00:40<03:02,  1.04it/s, mae=129.19]Training:   5%|▌         | 10/200 [00:40<03:02,  1.04it/s, mae=128.95]Training:   6%|▌         | 11/200 [00:40<02:36,  1.21it/s, mae=128.95]Training:   6%|▌         | 11/200 [00:41<02:36,  1.21it/s, mae=129.25]Training:   6%|▌         | 12/200 [00:41<02:18,  1.36it/s, mae=129.25]Training:   6%|▌         | 12/200 [00:41<02:18,  1.36it/s, mae=128.09]Training:   6%|▋         | 13/200 [00:41<02:05,  1.49it/s, mae=128.09]Training:   6%|▋         | 13/200 [00:42<02:05,  1.49it/s, mae=128.32]Training:   7%|▋         | 14/200 [00:42<01:56,  1.60it/s, mae=128.32]Training:   7%|▋         | 14/200 [00:42<01:56,  1.60it/s, mae=128.28]Training:   8%|▊         | 15/200 [00:42<01:50,  1.68it/s, mae=128.28]Training:   8%|▊         | 15/200 [00:43<01:50,  1.68it/s, mae=129.01]Training:   8%|▊         | 16/200 [00:43<01:45,  1.74it/s, mae=129.01]Training:   8%|▊         | 16/200 [00:43<01:45,  1.74it/s, mae=128.43]Training:   8%|▊         | 17/200 [00:43<01:42,  1.79it/s, mae=128.43]Training:   8%|▊         | 17/200 [00:44<01:42,  1.79it/s, mae=128.27]Training:   9%|▉         | 18/200 [00:44<01:39,  1.82it/s, mae=128.27]Training:   9%|▉         | 18/200 [00:44<01:39,  1.82it/s, mae=127.71]Training:  10%|▉         | 19/200 [00:44<01:38,  1.85it/s, mae=127.71]Training:  10%|▉         | 19/200 [00:45<01:38,  1.85it/s, mae=127.34]Training:  10%|█         | 20/200 [00:45<01:36,  1.86it/s, mae=127.34]Training:  10%|█         | 20/200 [00:45<01:36,  1.86it/s, mae=127.32]Training:  10%|█         | 21/200 [00:45<01:36,  1.86it/s, mae=127.32]Training:  10%|█         | 21/200 [00:46<01:36,  1.86it/s, mae=127.13]Training:  11%|█         | 22/200 [00:46<01:36,  1.85it/s, mae=127.13]Training:  11%|█         | 22/200 [00:46<01:36,  1.85it/s, mae=126.78]Training:  12%|█▏        | 23/200 [00:46<01:34,  1.87it/s, mae=126.78]Training:  12%|█▏        | 23/200 [00:47<01:34,  1.87it/s, mae=126.37]Training:  12%|█▏        | 24/200 [00:47<01:33,  1.87it/s, mae=126.37]Training:  12%|█▏        | 24/200 [00:48<01:33,  1.87it/s, mae=126.23]Training:  12%|█▎        | 25/200 [00:48<01:36,  1.82it/s, mae=126.23]Training:  12%|█▎        | 25/200 [00:48<01:36,  1.82it/s, mae=126.37]Training:  13%|█▎        | 26/200 [00:48<01:37,  1.78it/s, mae=126.37]Training:  13%|█▎        | 26/200 [00:49<01:37,  1.78it/s, mae=126.06]Training:  14%|█▎        | 27/200 [00:49<01:35,  1.82it/s, mae=126.06]Training:  14%|█▎        | 27/200 [00:49<01:35,  1.82it/s, mae=125.58]Training:  14%|█▍        | 28/200 [00:49<01:33,  1.83it/s, mae=125.58]Training:  14%|█▍        | 28/200 [00:50<01:33,  1.83it/s, mae=125.76]Training:  14%|█▍        | 29/200 [00:50<01:32,  1.85it/s, mae=125.76]Training:  14%|█▍        | 29/200 [00:50<01:32,  1.85it/s, mae=125.74]Training:  15%|█▌        | 30/200 [00:50<01:31,  1.86it/s, mae=125.74]Training:  15%|█▌        | 30/200 [00:51<01:31,  1.86it/s, mae=125.64]Training:  16%|█▌        | 31/200 [00:51<01:30,  1.87it/s, mae=125.64]Training:  16%|█▌        | 31/200 [00:51<01:30,  1.87it/s, mae=125.64]Training:  16%|█▌        | 32/200 [00:51<01:29,  1.88it/s, mae=125.64]Training:  16%|█▌        | 32/200 [00:52<01:29,  1.88it/s, mae=125.41]Training:  16%|█▋        | 33/200 [00:52<01:28,  1.89it/s, mae=125.41]Training:  16%|█▋        | 33/200 [00:52<01:28,  1.89it/s, mae=125.26]Training:  17%|█▋        | 34/200 [00:52<01:27,  1.89it/s, mae=125.26]Training:  17%|█▋        | 34/200 [00:53<01:27,  1.89it/s, mae=124.86]Training:  18%|█▊        | 35/200 [00:53<01:30,  1.83it/s, mae=124.86]Training:  18%|█▊        | 35/200 [00:53<01:30,  1.83it/s, mae=124.86]Training:  18%|█▊        | 36/200 [00:53<01:28,  1.85it/s, mae=124.86]Training:  18%|█▊        | 36/200 [00:54<01:28,  1.85it/s, mae=124.86]Training:  18%|█▊        | 37/200 [00:54<01:27,  1.86it/s, mae=124.86]Training:  18%|█▊        | 37/200 [00:54<01:27,  1.86it/s, mae=124.74]Training:  19%|█▉        | 38/200 [00:54<01:26,  1.87it/s, mae=124.74]Training:  19%|█▉        | 38/200 [00:55<01:26,  1.87it/s, mae=124.60]Training:  20%|█▉        | 39/200 [00:55<01:25,  1.88it/s, mae=124.60]Training:  20%|█▉        | 39/200 [00:56<01:25,  1.88it/s, mae=124.78]Training:  20%|██        | 40/200 [00:56<01:25,  1.88it/s, mae=124.78]Training:  20%|██        | 40/200 [00:56<01:25,  1.88it/s, mae=124.75]Training:  20%|██        | 41/200 [00:56<01:24,  1.88it/s, mae=124.75]Training:  20%|██        | 41/200 [00:57<01:24,  1.88it/s, mae=124.60]Training:  21%|██        | 42/200 [00:57<01:23,  1.89it/s, mae=124.60]Training:  21%|██        | 42/200 [00:57<01:23,  1.89it/s, mae=124.33]Training:  22%|██▏       | 43/200 [00:57<01:23,  1.89it/s, mae=124.33]Training:  22%|██▏       | 43/200 [00:58<01:23,  1.89it/s, mae=124.19]Training:  22%|██▏       | 44/200 [00:58<01:22,  1.89it/s, mae=124.19]Training:  22%|██▏       | 44/200 [00:58<01:22,  1.89it/s, mae=124.12]Training:  22%|██▎       | 45/200 [00:58<01:21,  1.89it/s, mae=124.12]Training:  22%|██▎       | 45/200 [00:59<01:21,  1.89it/s, mae=124.07]Training:  23%|██▎       | 46/200 [00:59<01:21,  1.90it/s, mae=124.07]Training:  23%|██▎       | 46/200 [00:59<01:21,  1.90it/s, mae=123.83]Training:  24%|██▎       | 47/200 [00:59<01:20,  1.90it/s, mae=123.83]Training:  24%|██▎       | 47/200 [01:00<01:20,  1.90it/s, mae=123.81]Training:  24%|██▍       | 48/200 [01:00<01:20,  1.90it/s, mae=123.81]Training:  24%|██▍       | 48/200 [01:00<01:20,  1.90it/s, mae=123.72]Training:  24%|██▍       | 49/200 [01:00<01:19,  1.90it/s, mae=123.72]Training:  24%|██▍       | 49/200 [01:01<01:19,  1.90it/s, mae=123.51]Training:  25%|██▌       | 50/200 [01:01<01:19,  1.90it/s, mae=123.51]Training:  25%|██▌       | 50/200 [01:01<01:19,  1.90it/s, mae=123.20]Training:  26%|██▌       | 51/200 [01:01<01:20,  1.85it/s, mae=123.20]Training:  26%|██▌       | 51/200 [01:02<01:20,  1.85it/s, mae=123.19]Training:  26%|██▌       | 52/200 [01:02<01:19,  1.86it/s, mae=123.19]Training:  26%|██▌       | 52/200 [01:02<01:19,  1.86it/s, mae=123.07]Training:  26%|██▋       | 53/200 [01:02<01:18,  1.87it/s, mae=123.07]Training:  26%|██▋       | 53/200 [01:03<01:18,  1.87it/s, mae=122.94]Training:  27%|██▋       | 54/200 [01:03<01:17,  1.88it/s, mae=122.94]Training:  27%|██▋       | 54/200 [01:04<01:17,  1.88it/s, mae=122.79]Training:  28%|██▊       | 55/200 [01:04<01:18,  1.84it/s, mae=122.79]Training:  28%|██▊       | 55/200 [01:04<01:18,  1.84it/s, mae=122.61]Training:  28%|██▊       | 56/200 [01:04<01:17,  1.85it/s, mae=122.61]Training:  28%|██▊       | 56/200 [01:05<01:17,  1.85it/s, mae=122.29]Training:  28%|██▊       | 57/200 [01:05<01:16,  1.87it/s, mae=122.29]Training:  28%|██▊       | 57/200 [01:05<01:16,  1.87it/s, mae=122.06]Training:  29%|██▉       | 58/200 [01:05<01:15,  1.87it/s, mae=122.06]Training:  29%|██▉       | 58/200 [01:06<01:15,  1.87it/s, mae=121.93]Training:  30%|██▉       | 59/200 [01:06<01:15,  1.88it/s, mae=121.93]Training:  30%|██▉       | 59/200 [01:06<01:15,  1.88it/s, mae=121.75]Training:  30%|███       | 60/200 [01:06<01:14,  1.88it/s, mae=121.75]Training:  30%|███       | 60/200 [01:07<01:14,  1.88it/s, mae=121.77]Training:  30%|███       | 61/200 [01:07<01:13,  1.89it/s, mae=121.77]Training:  30%|███       | 61/200 [01:07<01:13,  1.89it/s, mae=121.55]Training:  31%|███       | 62/200 [01:07<01:13,  1.89it/s, mae=121.55]Training:  31%|███       | 62/200 [01:08<01:13,  1.89it/s, mae=121.58]Training:  32%|███▏      | 63/200 [01:08<01:12,  1.89it/s, mae=121.58]Training:  32%|███▏      | 63/200 [01:08<01:12,  1.89it/s, mae=121.41]Training:  32%|███▏      | 64/200 [01:08<01:12,  1.89it/s, mae=121.41]Training:  32%|███▏      | 64/200 [01:09<01:12,  1.89it/s, mae=121.28]Training:  32%|███▎      | 65/200 [01:09<01:11,  1.89it/s, mae=121.28]Training:  32%|███▎      | 65/200 [01:09<01:11,  1.89it/s, mae=121.04]Training:  33%|███▎      | 66/200 [01:09<01:11,  1.89it/s, mae=121.04]Training:  33%|███▎      | 66/200 [01:10<01:11,  1.89it/s, mae=120.92]Training:  34%|███▎      | 67/200 [01:10<01:10,  1.89it/s, mae=120.92]Training:  34%|███▎      | 67/200 [01:10<01:10,  1.89it/s, mae=120.68]Training:  34%|███▍      | 68/200 [01:10<01:09,  1.89it/s, mae=120.68]Training:  34%|███▍      | 68/200 [01:11<01:09,  1.89it/s, mae=120.50]Training:  34%|███▍      | 69/200 [01:11<01:09,  1.89it/s, mae=120.50]Training:  34%|███▍      | 69/200 [01:11<01:09,  1.89it/s, mae=120.26]Training:  35%|███▌      | 70/200 [01:11<01:08,  1.89it/s, mae=120.26]Training:  35%|███▌      | 70/200 [01:12<01:08,  1.89it/s, mae=120.23]Training:  36%|███▌      | 71/200 [01:12<01:08,  1.89it/s, mae=120.23]Training:  36%|███▌      | 71/200 [01:13<01:08,  1.89it/s, mae=120.04]Training:  36%|███▌      | 72/200 [01:13<01:07,  1.89it/s, mae=120.04]Training:  36%|███▌      | 72/200 [01:13<01:07,  1.89it/s, mae=119.98]Training:  36%|███▋      | 73/200 [01:13<01:07,  1.89it/s, mae=119.98]Training:  36%|███▋      | 73/200 [01:14<01:07,  1.89it/s, mae=119.72]Training:  37%|███▋      | 74/200 [01:14<01:07,  1.88it/s, mae=119.72]Training:  37%|███▋      | 74/200 [01:14<01:07,  1.88it/s, mae=119.53]Training:  38%|███▊      | 75/200 [01:14<01:06,  1.88it/s, mae=119.53]Training:  38%|███▊      | 75/200 [01:15<01:06,  1.88it/s, mae=119.40]Training:  38%|███▊      | 76/200 [01:15<01:06,  1.85it/s, mae=119.40]Training:  38%|███▊      | 76/200 [01:15<01:06,  1.85it/s, mae=119.31]Training:  38%|███▊      | 77/200 [01:15<01:06,  1.86it/s, mae=119.31]Training:  38%|███▊      | 77/200 [01:16<01:06,  1.86it/s, mae=119.30]Training:  39%|███▉      | 78/200 [01:16<01:05,  1.87it/s, mae=119.30]Training:  39%|███▉      | 78/200 [01:16<01:05,  1.87it/s, mae=119.08]Training:  40%|███▉      | 79/200 [01:16<01:04,  1.87it/s, mae=119.08]Training:  40%|███▉      | 79/200 [01:17<01:04,  1.87it/s, mae=118.96]Training:  40%|████      | 80/200 [01:17<01:03,  1.88it/s, mae=118.96]Training:  40%|████      | 80/200 [01:17<01:03,  1.88it/s, mae=118.78]Training:  40%|████      | 81/200 [01:17<01:03,  1.88it/s, mae=118.78]Training:  40%|████      | 81/200 [01:18<01:03,  1.88it/s, mae=118.51]Training:  41%|████      | 82/200 [01:18<01:02,  1.89it/s, mae=118.51]Training:  41%|████      | 82/200 [01:18<01:02,  1.89it/s, mae=118.54]Training:  42%|████▏     | 83/200 [01:18<01:01,  1.89it/s, mae=118.54]Training:  42%|████▏     | 83/200 [01:19<01:01,  1.89it/s, mae=118.36]Training:  42%|████▏     | 84/200 [01:19<01:01,  1.89it/s, mae=118.36]Training:  42%|████▏     | 84/200 [01:19<01:01,  1.89it/s, mae=118.12]Training:  42%|████▎     | 85/200 [01:19<01:00,  1.89it/s, mae=118.12]Training:  42%|████▎     | 85/200 [01:20<01:00,  1.89it/s, mae=117.90]Training:  43%|████▎     | 86/200 [01:20<01:00,  1.89it/s, mae=117.90]Training:  43%|████▎     | 86/200 [01:21<01:00,  1.89it/s, mae=117.58]Training:  44%|████▎     | 87/200 [01:21<00:59,  1.89it/s, mae=117.58]Training:  44%|████▎     | 87/200 [01:21<00:59,  1.89it/s, mae=117.53]Training:  44%|████▍     | 88/200 [01:21<00:59,  1.89it/s, mae=117.53]Training:  44%|████▍     | 88/200 [01:22<00:59,  1.89it/s, mae=117.32]Training:  44%|████▍     | 89/200 [01:22<00:58,  1.89it/s, mae=117.32]Training:  44%|████▍     | 89/200 [01:22<00:58,  1.89it/s, mae=117.17]Training:  45%|████▌     | 90/200 [01:22<00:58,  1.90it/s, mae=117.17]Training:  45%|████▌     | 90/200 [01:23<00:58,  1.90it/s, mae=117.00]Training:  46%|████▌     | 91/200 [01:23<00:57,  1.89it/s, mae=117.00]Training:  46%|████▌     | 91/200 [01:23<00:57,  1.89it/s, mae=116.81]Training:  46%|████▌     | 92/200 [01:23<00:57,  1.89it/s, mae=116.81]Training:  46%|████▌     | 92/200 [01:24<00:57,  1.89it/s, mae=116.54]Training:  46%|████▋     | 93/200 [01:24<00:56,  1.89it/s, mae=116.54]Training:  46%|████▋     | 93/200 [01:24<00:56,  1.89it/s, mae=116.25]Training:  47%|████▋     | 94/200 [01:24<00:55,  1.89it/s, mae=116.25]Training:  47%|████▋     | 94/200 [01:25<00:55,  1.89it/s, mae=116.09]Training:  48%|████▊     | 95/200 [01:25<00:55,  1.90it/s, mae=116.09]Training:  48%|████▊     | 95/200 [01:25<00:55,  1.90it/s, mae=115.92]Training:  48%|████▊     | 96/200 [01:25<00:54,  1.90it/s, mae=115.92]Training:  48%|████▊     | 96/200 [01:26<00:54,  1.90it/s, mae=115.83]Training:  48%|████▊     | 97/200 [01:26<00:56,  1.83it/s, mae=115.83]Training:  48%|████▊     | 97/200 [01:26<00:56,  1.83it/s, mae=115.51]Training:  49%|████▉     | 98/200 [01:26<00:55,  1.85it/s, mae=115.51]Training:  49%|████▉     | 98/200 [01:27<00:55,  1.85it/s, mae=115.41]Training:  50%|████▉     | 99/200 [01:27<00:54,  1.86it/s, mae=115.41]Training:  50%|████▉     | 99/200 [01:27<00:54,  1.86it/s, mae=115.38]Training:  50%|█████     | 100/200 [01:27<00:53,  1.87it/s, mae=115.38]Training:  50%|█████     | 100/200 [01:28<00:53,  1.87it/s, mae=115.26]Training:  50%|█████     | 101/200 [01:28<00:52,  1.88it/s, mae=115.26]Training:  50%|█████     | 101/200 [01:29<00:52,  1.88it/s, mae=115.19]Training:  51%|█████     | 102/200 [01:29<00:53,  1.84it/s, mae=115.19]Training:  51%|█████     | 102/200 [01:29<00:53,  1.84it/s, mae=115.09]Training:  52%|█████▏    | 103/200 [01:29<00:52,  1.86it/s, mae=115.09]Training:  52%|█████▏    | 103/200 [01:30<00:52,  1.86it/s, mae=114.98]Training:  52%|█████▏    | 104/200 [01:30<00:51,  1.87it/s, mae=114.98]Training:  52%|█████▏    | 104/200 [01:30<00:51,  1.87it/s, mae=114.77]Training:  52%|█████▎    | 105/200 [01:30<00:50,  1.88it/s, mae=114.77]Training:  52%|█████▎    | 105/200 [01:31<00:50,  1.88it/s, mae=114.62]Training:  53%|█████▎    | 106/200 [01:31<00:49,  1.88it/s, mae=114.62]Training:  53%|█████▎    | 106/200 [01:31<00:49,  1.88it/s, mae=114.54]Training:  54%|█████▎    | 107/200 [01:31<00:49,  1.89it/s, mae=114.54]Training:  54%|█████▎    | 107/200 [01:32<00:49,  1.89it/s, mae=114.37]Training:  54%|█████▍    | 108/200 [01:32<00:48,  1.89it/s, mae=114.37]Training:  54%|█████▍    | 108/200 [01:32<00:48,  1.89it/s, mae=114.17]Training:  55%|█████▍    | 109/200 [01:32<00:48,  1.86it/s, mae=114.17]Training:  55%|█████▍    | 109/200 [01:33<00:48,  1.86it/s, mae=114.08]Training:  55%|█████▌    | 110/200 [01:33<00:48,  1.87it/s, mae=114.08]Training:  55%|█████▌    | 110/200 [01:33<00:48,  1.87it/s, mae=114.02]Training:  56%|█████▌    | 111/200 [01:33<00:47,  1.88it/s, mae=114.02]Training:  56%|█████▌    | 111/200 [01:34<00:47,  1.88it/s, mae=113.77]Training:  56%|█████▌    | 112/200 [01:34<00:47,  1.87it/s, mae=113.77]Training:  56%|█████▌    | 112/200 [01:34<00:47,  1.87it/s, mae=113.71]Training:  56%|█████▋    | 113/200 [01:34<00:46,  1.88it/s, mae=113.71]Training:  56%|█████▋    | 113/200 [01:35<00:46,  1.88it/s, mae=113.51]Training:  57%|█████▋    | 114/200 [01:35<00:45,  1.88it/s, mae=113.51]Training:  57%|█████▋    | 114/200 [01:35<00:45,  1.88it/s, mae=113.34]Training:  57%|█████▊    | 115/200 [01:35<00:45,  1.88it/s, mae=113.34]Training:  57%|█████▊    | 115/200 [01:36<00:45,  1.88it/s, mae=113.18]Training:  58%|█████▊    | 116/200 [01:36<00:44,  1.88it/s, mae=113.18]Training:  58%|█████▊    | 116/200 [01:37<00:44,  1.88it/s, mae=113.03]Training:  58%|█████▊    | 117/200 [01:37<00:43,  1.89it/s, mae=113.03]Training:  58%|█████▊    | 117/200 [01:37<00:43,  1.89it/s, mae=112.79]Training:  59%|█████▉    | 118/200 [01:37<00:43,  1.89it/s, mae=112.79]Training:  59%|█████▉    | 118/200 [01:38<00:43,  1.89it/s, mae=112.70]Training:  60%|█████▉    | 119/200 [01:38<00:43,  1.84it/s, mae=112.70]Training:  60%|█████▉    | 119/200 [01:38<00:43,  1.84it/s, mae=112.63]Training:  60%|██████    | 120/200 [01:38<00:43,  1.85it/s, mae=112.63]Training:  60%|██████    | 120/200 [01:39<00:43,  1.85it/s, mae=112.41]Training:  60%|██████    | 121/200 [01:39<00:42,  1.87it/s, mae=112.41]Training:  60%|██████    | 121/200 [01:39<00:42,  1.87it/s, mae=112.16]Training:  61%|██████    | 122/200 [01:39<00:42,  1.83it/s, mae=112.16]Training:  61%|██████    | 122/200 [01:40<00:42,  1.83it/s, mae=111.97]Training:  62%|██████▏   | 123/200 [01:40<00:41,  1.85it/s, mae=111.97]Training:  62%|██████▏   | 123/200 [01:40<00:41,  1.85it/s, mae=111.77]Training:  62%|██████▏   | 124/200 [01:40<00:40,  1.86it/s, mae=111.77]Training:  62%|██████▏   | 124/200 [01:41<00:40,  1.86it/s, mae=111.52]Training:  62%|██████▎   | 125/200 [01:41<00:40,  1.87it/s, mae=111.52]Training:  62%|██████▎   | 125/200 [01:41<00:40,  1.87it/s, mae=111.43]Training:  63%|██████▎   | 126/200 [01:41<00:39,  1.87it/s, mae=111.43]Training:  63%|██████▎   | 126/200 [01:42<00:39,  1.87it/s, mae=111.30]Training:  64%|██████▎   | 127/200 [01:42<00:39,  1.85it/s, mae=111.30]Training:  64%|██████▎   | 127/200 [01:42<00:39,  1.85it/s, mae=111.15]Training:  64%|██████▍   | 128/200 [01:42<00:38,  1.86it/s, mae=111.15]Training:  64%|██████▍   | 128/200 [01:43<00:38,  1.86it/s, mae=110.94]Training:  64%|██████▍   | 129/200 [01:43<00:37,  1.87it/s, mae=110.94]Training:  64%|██████▍   | 129/200 [01:43<00:37,  1.87it/s, mae=110.74]Training:  65%|██████▌   | 130/200 [01:43<00:37,  1.88it/s, mae=110.74]Training:  65%|██████▌   | 130/200 [01:44<00:37,  1.88it/s, mae=110.52]Training:  66%|██████▌   | 131/200 [01:44<00:37,  1.83it/s, mae=110.52]Training:  66%|██████▌   | 131/200 [01:45<00:37,  1.83it/s, mae=110.39]Training:  66%|██████▌   | 132/200 [01:45<00:36,  1.85it/s, mae=110.39]Training:  66%|██████▌   | 132/200 [01:45<00:36,  1.85it/s, mae=110.21]Training:  66%|██████▋   | 133/200 [01:45<00:36,  1.86it/s, mae=110.21]Training:  66%|██████▋   | 133/200 [01:46<00:36,  1.86it/s, mae=110.06]Training:  67%|██████▋   | 134/200 [01:46<00:35,  1.86it/s, mae=110.06]Training:  67%|██████▋   | 134/200 [01:46<00:35,  1.86it/s, mae=109.97]Training:  68%|██████▊   | 135/200 [01:46<00:34,  1.87it/s, mae=109.97]Training:  68%|██████▊   | 135/200 [01:47<00:34,  1.87it/s, mae=109.78]Training:  68%|██████▊   | 136/200 [01:47<00:34,  1.88it/s, mae=109.78]Training:  68%|██████▊   | 136/200 [01:47<00:34,  1.88it/s, mae=109.56]Training:  68%|██████▊   | 137/200 [01:47<00:33,  1.88it/s, mae=109.56]Training:  68%|██████▊   | 137/200 [01:48<00:33,  1.88it/s, mae=109.24]Training:  69%|██████▉   | 138/200 [01:48<00:33,  1.88it/s, mae=109.24]Training:  69%|██████▉   | 138/200 [01:48<00:33,  1.88it/s, mae=109.07]Training:  70%|██████▉   | 139/200 [01:48<00:32,  1.88it/s, mae=109.07]Training:  70%|██████▉   | 139/200 [01:49<00:32,  1.88it/s, mae=108.90]Training:  70%|███████   | 140/200 [01:49<00:32,  1.86it/s, mae=108.90]Training:  70%|███████   | 140/200 [01:49<00:32,  1.86it/s, mae=108.71]Training:  70%|███████   | 141/200 [01:49<00:31,  1.87it/s, mae=108.71]Training:  70%|███████   | 141/200 [01:50<00:31,  1.87it/s, mae=108.62]Training:  71%|███████   | 142/200 [01:50<00:30,  1.87it/s, mae=108.62]Training:  71%|███████   | 142/200 [01:50<00:30,  1.87it/s, mae=108.45]Training:  72%|███████▏  | 143/200 [01:50<00:30,  1.88it/s, mae=108.45]Training:  72%|███████▏  | 143/200 [01:51<00:30,  1.88it/s, mae=108.23]Training:  72%|███████▏  | 144/200 [01:51<00:29,  1.88it/s, mae=108.23]Training:  72%|███████▏  | 144/200 [01:52<00:29,  1.88it/s, mae=108.06]Training:  72%|███████▎  | 145/200 [01:52<00:30,  1.82it/s, mae=108.06]Training:  72%|███████▎  | 145/200 [01:52<00:30,  1.82it/s, mae=107.94]Training:  73%|███████▎  | 146/200 [01:52<00:29,  1.84it/s, mae=107.94]Training:  73%|███████▎  | 146/200 [01:53<00:29,  1.84it/s, mae=107.73]Training:  74%|███████▎  | 147/200 [01:53<00:28,  1.85it/s, mae=107.73]Training:  74%|███████▎  | 147/200 [01:53<00:28,  1.85it/s, mae=107.56]Training:  74%|███████▍  | 148/200 [01:53<00:27,  1.86it/s, mae=107.56]Training:  74%|███████▍  | 148/200 [01:54<00:27,  1.86it/s, mae=107.38]Training:  74%|███████▍  | 149/200 [01:54<00:27,  1.87it/s, mae=107.38]Training:  74%|███████▍  | 149/200 [01:54<00:27,  1.87it/s, mae=107.20]Training:  75%|███████▌  | 150/200 [01:54<00:26,  1.88it/s, mae=107.20]Training:  75%|███████▌  | 150/200 [01:55<00:26,  1.88it/s, mae=107.00]Training:  76%|███████▌  | 151/200 [01:55<00:26,  1.88it/s, mae=107.00]Training:  76%|███████▌  | 151/200 [01:55<00:26,  1.88it/s, mae=106.86]Training:  76%|███████▌  | 152/200 [01:55<00:25,  1.88it/s, mae=106.86]Training:  76%|███████▌  | 152/200 [01:56<00:25,  1.88it/s, mae=106.67]Training:  76%|███████▋  | 153/200 [01:56<00:24,  1.88it/s, mae=106.67]Training:  76%|███████▋  | 153/200 [01:56<00:24,  1.88it/s, mae=106.47]Training:  77%|███████▋  | 154/200 [01:56<00:24,  1.89it/s, mae=1