Training:   0%|          | 0/200 [00:00<?, ?it/s]Training:   0%|          | 0/200 [00:16<?, ?it/s, mae=134.08]Training:   0%|          | 1/200 [00:16<55:37, 16.77s/it, mae=134.08]Training:   0%|          | 1/200 [00:16<55:37, 16.77s/it, mae=134.35]Training:   1%|          | 2/200 [00:16<23:10,  7.02s/it, mae=134.35]Training:   1%|          | 2/200 [00:17<23:10,  7.02s/it, mae=131.27]Training:   2%|▏         | 3/200 [00:17<12:44,  3.88s/it, mae=131.27]Training:   2%|▏         | 3/200 [00:17<12:44,  3.88s/it, mae=128.82]Training:   2%|▏         | 4/200 [00:17<07:51,  2.41s/it, mae=128.82]Training:   2%|▏         | 4/200 [00:17<07:51,  2.41s/it, mae=127.76]Training:   2%|▎         | 5/200 [00:17<05:10,  1.59s/it, mae=127.76]Training:   2%|▎         | 5/200 [00:17<05:10,  1.59s/it, mae=128.44]Training:   3%|▎         | 6/200 [00:17<03:33,  1.10s/it, mae=128.44]Training:   3%|▎         | 6/200 [00:17<03:33,  1.10s/it, mae=128.23]Training:   4%|▎         | 7/200 [00:17<02:32,  1.26it/s, mae=128.23]Training:   4%|▎         | 7/200 [00:17<02:32,  1.26it/s, mae=128.27]Training:   4%|▍         | 8/200 [00:17<01:52,  1.71it/s, mae=128.27]Training:   4%|▍         | 8/200 [00:17<01:52,  1.71it/s, mae=128.04]Training:   4%|▍         | 9/200 [00:17<01:25,  2.24it/s, mae=128.04]Training:   4%|▍         | 9/200 [00:18<01:25,  2.24it/s, mae=126.50]Training:   5%|▌         | 10/200 [00:18<01:07,  2.82it/s, mae=126.50]Training:   5%|▌         | 10/200 [00:18<01:07,  2.82it/s, mae=125.98]Training:   6%|▌         | 11/200 [00:18<00:55,  3.39it/s, mae=125.98]Training:   6%|▌         | 11/200 [00:18<00:55,  3.39it/s, mae=126.32]Training:   6%|▌         | 12/200 [00:18<00:46,  4.02it/s, mae=126.32]Training:   6%|▌         | 12/200 [00:18<00:46,  4.02it/s, mae=125.99]Training:   6%|▋         | 13/200 [00:18<00:40,  4.60it/s, mae=125.99]Training:   6%|▋         | 13/200 [00:18<00:40,  4.60it/s, mae=125.75]Training:   7%|▋         | 14/200 [00:18<00:37,  5.02it/s, mae=125.75]Training:   7%|▋         | 14/200 [00:18<00:37,  5.02it/s, mae=125.68]Training:   8%|▊         | 15/200 [00:18<00:33,  5.48it/s, mae=125.68]Training:   8%|▊         | 15/200 [00:19<00:33,  5.48it/s, mae=125.32]Training:   8%|▊         | 16/200 [00:19<00:31,  5.85it/s, mae=125.32]Training:   8%|▊         | 16/200 [00:19<00:31,  5.85it/s, mae=125.16]Training:   8%|▊         | 17/200 [00:19<00:30,  6.07it/s, mae=125.16]Training:   8%|▊         | 17/200 [00:19<00:30,  6.07it/s, mae=124.86]Training:   9%|▉         | 18/200 [00:19<00:29,  6.19it/s, mae=124.86]Training:   9%|▉         | 18/200 [00:19<00:29,  6.19it/s, mae=124.77]Training:  10%|▉         | 19/200 [00:19<00:28,  6.26it/s, mae=124.77]Training:  10%|▉         | 19/200 [00:19<00:28,  6.26it/s, mae=124.41]Training:  10%|█         | 20/200 [00:19<00:28,  6.39it/s, mae=124.41]Training:  10%|█         | 20/200 [00:19<00:28,  6.39it/s, mae=124.03]Training:  10%|█         | 21/200 [00:19<00:27,  6.62it/s, mae=124.03]Training:  10%|█         | 21/200 [00:19<00:27,  6.62it/s, mae=123.19]Training:  11%|█         | 22/200 [00:19<00:26,  6.72it/s, mae=123.19]Training:  11%|█         | 22/200 [00:20<00:26,  6.72it/s, mae=122.71]Training:  12%|█▏        | 23/200 [00:20<00:26,  6.60it/s, mae=122.71]Training:  12%|█▏        | 23/200 [00:20<00:26,  6.60it/s, mae=122.11]Training:  12%|█▏        | 24/200 [00:20<00:26,  6.70it/s, mae=122.11]Training:  12%|█▏        | 24/200 [00:20<00:26,  6.70it/s, mae=121.67]Training:  12%|█▎        | 25/200 [00:20<00:25,  6.76it/s, mae=121.67]Training:  12%|█▎        | 25/200 [00:20<00:25,  6.76it/s, mae=121.27]Training:  13%|█▎        | 26/200 [00:20<00:25,  6.81it/s, mae=121.27]Training:  13%|█▎        | 26/200 [00:20<00:25,  6.81it/s, mae=120.93]Training:  14%|█▎        | 27/200 [00:20<00:25,  6.85it/s, mae=120.93]Training:  14%|█▎        | 27/200 [00:20<00:25,  6.85it/s, mae=120.40]Training:  14%|█▍        | 28/200 [00:20<00:24,  6.88it/s, mae=120.40]Training:  14%|█▍        | 28/200 [00:20<00:24,  6.88it/s, mae=120.22]Training:  14%|█▍        | 29/200 [00:20<00:24,  6.90it/s, mae=120.22]Training:  14%|█▍        | 29/200 [00:21<00:24,  6.90it/s, mae=119.99]Training:  15%|█▌        | 30/200 [00:21<00:25,  6.68it/s, mae=119.99]Training:  15%|█▌        | 30/200 [00:21<00:25,  6.68it/s, mae=119.69]Training:  16%|█▌        | 31/200 [00:21<00:25,  6.76it/s, mae=119.69]Training:  16%|█▌        | 31/200 [00:21<00:25,  6.76it/s, mae=119.31]Training:  16%|█▌        | 32/200 [00:21<00:24,  6.72it/s, mae=119.31]Training:  16%|█▌        | 32/200 [00:21<00:24,  6.72it/s, mae=118.90]Training:  16%|█▋        | 33/200 [00:21<00:24,  6.78it/s, mae=118.90]Training:  16%|█▋        | 33/200 [00:21<00:24,  6.78it/s, mae=118.60]Training:  17%|█▋        | 34/200 [00:21<00:24,  6.80it/s, mae=118.60]Training:  17%|█▋        | 34/200 [00:21<00:24,  6.80it/s, mae=118.21]Training:  18%|█▊        | 35/200 [00:21<00:24,  6.84it/s, mae=118.21]Training:  18%|█▊        | 35/200 [00:21<00:24,  6.84it/s, mae=117.69]Training:  18%|█▊        | 36/200 [00:21<00:23,  6.88it/s, mae=117.69]Training:  18%|█▊        | 36/200 [00:22<00:23,  6.88it/s, mae=117.07]Training:  18%|█▊        | 37/200 [00:22<00:23,  6.89it/s, mae=117.07]Training:  18%|█▊        | 37/200 [00:22<00:23,  6.89it/s, mae=116.85]Training:  19%|█▉        | 38/200 [00:22<00:23,  6.78it/s, mae=116.85]Training:  19%|█▉        | 38/200 [00:22<00:23,  6.78it/s, mae=116.58]Training:  20%|█▉        | 39/200 [00:22<00:24,  6.64it/s, mae=116.58]Training:  20%|█▉        | 39/200 [00:22<00:24,  6.64it/s, mae=116.23]Training:  20%|██        | 40/200 [00:22<00:24,  6.53it/s, mae=116.23]Training:  20%|██        | 40/200 [00:22<00:24,  6.53it/s, mae=115.83]Training:  20%|██        | 41/200 [00:22<00:23,  6.65it/s, mae=115.83]Training:  20%|██        | 41/200 [00:22<00:23,  6.65it/s, mae=115.40]Training:  21%|██        | 42/200 [00:22<00:24,  6.56it/s, mae=115.40]Training:  21%|██        | 42/200 [00:23<00:24,  6.56it/s, mae=115.26]Training:  22%|██▏       | 43/200 [00:23<00:24,  6.46it/s, mae=115.26]Training:  22%|██▏       | 43/200 [00:23<00:24,  6.46it/s, mae=115.19]Training:  22%|██▏       | 44/200 [00:23<00:24,  6.38it/s, mae=115.19]Training:  22%|██▏       | 44/200 [00:23<00:24,  6.38it/s, mae=114.86]Training:  22%|██▎       | 45/200 [00:23<00:23,  6.53it/s, mae=114.86]Training:  22%|██▎       | 45/200 [00:23<00:23,  6.53it/s, mae=114.57]Training:  23%|██▎       | 46/200 [00:23<00:23,  6.64it/s, mae=114.57]Training:  23%|██▎       | 46/200 [00:23<00:23,  6.64it/s, mae=114.18]Training:  24%|██▎       | 47/200 [00:23<00:22,  6.73it/s, mae=114.18]Training:  24%|██▎       | 47/200 [00:23<00:22,  6.73it/s, mae=113.61]Training:  24%|██▍       | 48/200 [00:23<00:22,  6.77it/s, mae=113.61]Training:  24%|██▍       | 48/200 [00:23<00:22,  6.77it/s, mae=113.36]Training:  24%|██▍       | 49/200 [00:23<00:22,  6.78it/s, mae=113.36]Training:  24%|██▍       | 49/200 [00:24<00:22,  6.78it/s, mae=112.96]Training:  25%|██▌       | 50/200 [00:24<00:21,  6.84it/s, mae=112.96]Training:  25%|██▌       | 50/200 [00:24<00:21,  6.84it/s, mae=112.76]Training:  26%|██▌       | 51/200 [00:24<00:21,  6.83it/s, mae=112.76]Training:  26%|██▌       | 51/200 [00:24<00:21,  6.83it/s, mae=112.63]Training:  26%|██▌       | 52/200 [00:24<00:21,  6.88it/s, mae=112.63]Training:  26%|██▌       | 52/200 [00:24<00:21,  6.88it/s, mae=112.47]Training:  26%|██▋       | 53/200 [00:24<00:22,  6.66it/s, mae=112.47]Training:  26%|██▋       | 53/200 [00:24<00:22,  6.66it/s, mae=112.30]Training:  27%|██▋       | 54/200 [00:24<00:21,  6.74it/s, mae=112.30]Training:  27%|██▋       | 54/200 [00:24<00:21,  6.74it/s, mae=112.00]Training:  28%|██▊       | 55/200 [00:24<00:21,  6.73it/s, mae=112.00]Training:  28%|██▊       | 55/200 [00:24<00:21,  6.73it/s, mae=111.51]Training:  28%|██▊       | 56/200 [00:24<00:21,  6.81it/s, mae=111.51]Training:  28%|██▊       | 56/200 [00:25<00:21,  6.81it/s, mae=111.26]Training:  28%|██▊       | 57/200 [00:25<00:21,  6.52it/s, mae=111.26]Training:  28%|██▊       | 57/200 [00:25<00:21,  6.52it/s, mae=110.89]Training:  29%|██▉       | 58/200 [00:25<00:21,  6.57it/s, mae=110.89]Training:  29%|██▉       | 58/200 [00:25<00:21,  6.57it/s, mae=110.56]Training:  30%|██▉       | 59/200 [00:25<00:21,  6.45it/s, mae=110.56]Training:  30%|██▉       | 59/200 [00:25<00:21,  6.45it/s, mae=110.24]Training:  30%|███       | 60/200 [00:25<00:21,  6.57it/s, mae=110.24]Training:  30%|███       | 60/200 [00:25<00:21,  6.57it/s, mae=109.62]Training:  30%|███       | 61/200 [00:25<00:21,  6.51it/s, mae=109.62]Training:  30%|███       | 61/200 [00:25<00:21,  6.51it/s, mae=109.16]Training:  31%|███       | 62/200 [00:25<00:20,  6.65it/s, mae=109.16]Training:  31%|███       | 62/200 [00:26<00:20,  6.65it/s, mae=108.76]Training:  32%|███▏      | 63/200 [00:26<00:20,  6.74it/s, mae=108.76]Training:  32%|███▏      | 63/200 [00:26<00:20,  6.74it/s, mae=108.60]Training:  32%|███▏      | 64/200 [00:26<00:20,  6.80it/s, mae=108.60]Training:  32%|███▏      | 64/200 [00:26<00:20,  6.80it/s, mae=108.15]Training:  32%|███▎      | 65/200 [00:26<00:19,  6.85it/s, mae=108.15]Training:  32%|███▎      | 65/200 [00:26<00:19,  6.85it/s, mae=107.65]Training:  33%|███▎      | 66/200 [00:26<00:19,  6.87it/s, mae=107.65]Training:  33%|███▎      | 66/200 [00:26<00:19,  6.87it/s, mae=107.24]Training:  34%|███▎      | 67/200 [00:26<00:19,  6.68it/s, mae=107.24]Training:  34%|███▎      | 67/200 [00:26<00:19,  6.68it/s, mae=106.78]Training:  34%|███▍      | 68/200 [00:26<00:19,  6.76it/s, mae=106.78]Training:  34%|███▍      | 68/200 [00:26<00:19,  6.76it/s, mae=106.45]Training:  34%|███▍      | 69/200 [00:26<00:19,  6.81it/s, mae=106.45]Training:  34%|███▍      | 69/200 [00:27<00:19,  6.81it/s, mae=106.00]Training:  35%|███▌      | 70/200 [00:27<00:18,  6.85it/s, mae=106.00]Training:  35%|███▌      | 70/200 [00:27<00:18,  6.85it/s, mae=105.66]Training:  36%|███▌      | 71/200 [00:27<00:18,  6.84it/s, mae=105.66]Training:  36%|███▌      | 71/200 [00:27<00:18,  6.84it/s, mae=105.46]Training:  36%|███▌      | 72/200 [00:27<00:18,  6.88it/s, mae=105.46]Training:  36%|███▌      | 72/200 [00:27<00:18,  6.88it/s, mae=104.89]Training:  36%|███▋      | 73/200 [00:27<00:18,  6.90it/s, mae=104.89]Training:  36%|███▋      | 73/200 [00:27<00:18,  6.90it/s, mae=104.51]Training:  37%|███▋      | 74/200 [00:27<00:18,  6.78it/s, mae=104.51]Training:  37%|███▋      | 74/200 [00:27<00:18,  6.78it/s, mae=104.23]Training:  38%|███▊      | 75/200 [00:27<00:18,  6.84it/s, mae=104.23]Training:  38%|███▊      | 75/200 [00:27<00:18,  6.84it/s, mae=103.99]Training:  38%|███▊      | 76/200 [00:27<00:19,  6.40it/s, mae=103.99]Training:  38%|███▊      | 76/200 [00:28<00:19,  6.40it/s, mae=103.49]Training:  38%|███▊      | 77/200 [00:28<00:18,  6.55it/s, mae=103.49]Training:  38%|███▊      | 77/200 [00:28<00:18,  6.55it/s, mae=103.09]Training:  39%|███▉      | 78/200 [00:28<00:18,  6.47it/s, mae=103.09]Training:  39%|███▉      | 78/200 [00:28<00:18,  6.47it/s, mae=102.68]Training:  40%|███▉      | 79/200 [00:28<00:18,  6.60it/s, mae=102.68]Training:  40%|███▉      | 79/200 [00:28<00:18,  6.60it/s, mae=102.48]Training:  40%|████      | 80/200 [00:28<00:18,  6.53it/s, mae=102.48]Training:  40%|████      | 80/200 [00:28<00:18,  6.53it/s, mae=102.29]Training:  40%|████      | 81/200 [00:28<00:17,  6.65it/s, mae=102.29]Training:  40%|████      | 81/200 [00:28<00:17,  6.65it/s, mae=101.89]Training:  41%|████      | 82/200 [00:28<00:17,  6.79it/s, mae=101.89]Training:  41%|████      | 82/200 [00:29<00:17,  6.79it/s, mae=101.61]Training:  42%|████▏     | 83/200 [00:29<00:17,  6.83it/s, mae=101.61]Training:  42%|████▏     | 83/200 [00:29<00:17,  6.83it/s, mae=101.27]Training:  42%|████▏     | 84/200 [00:29<00:17,  6.67it/s, mae=101.27]Training:  42%|████▏     | 84/200 [00:29<00:17,  6.67it/s, mae=100.86]Training:  42%|████▎     | 85/200 [00:29<00:17,  6.76it/s, mae=100.86]Training:  42%|████▎     | 85/200 [00:29<00:17,  6.76it/s, mae=100.62]Training:  43%|████▎     | 86/200 [00:29<00:16,  6.83it/s, mae=100.62]Training:  43%|████▎     | 86/200 [00:29<00:16,  6.83it/s, mae=100.31]Training:  44%|████▎     | 87/200 [00:29<00:16,  6.87it/s, mae=100.31]Training:  44%|████▎     | 87/200 [00:29<00:16,  6.87it/s, mae=99.96] Training:  44%|████▍     | 88/200 [00:29<00:16,  6.66it/s, mae=99.96]Training:  44%|████▍     | 88/200 [00:29<00:16,  6.66it/s, mae=99.70]Training:  44%|████▍     | 89/200 [00:29<00:16,  6.75it/s, mae=99.70]Training:  44%|████▍     | 89/200 [00:30<00:16,  6.75it/s, mae=99.33]Training:  45%|████▌     | 90/200 [00:30<00:16,  6.81it/s, mae=99.33]Training:  45%|████▌     | 90/200 [00:30<00:16,  6.81it/s, mae=99.09]Training:  46%|████▌     | 91/200 [00:30<00:15,  6.85it/s, mae=99.09]Training:  46%|████▌     | 91/200 [00:30<00:15,  6.85it/s, mae=98.76]Training:  46%|████▌     | 92/200 [00:30<00:15,  6.86it/s, mae=98.76]Training:  46%|████▌     | 92/200 [00:30<00:15,  6.86it/s, mae=98.41]Training:  46%|████▋     | 93/200 [00:30<00:15,  6.73it/s, mae=98.41]Training:  46%|████▋     | 93/200 [00:30<00:15,  6.73it/s, mae=98.03]Training:  47%|████▋     | 94/200 [00:30<00:16,  6.55it/s, mae=98.03]Training:  47%|████▋     | 94/200 [00:30<00:16,  6.55it/s, mae=97.70]Training:  48%|████▊     | 95/200 [00:30<00:16,  6.52it/s, mae=97.70]Training:  48%|████▊     | 95/200 [00:30<00:16,  6.52it/s, mae=97.24]Training:  48%|████▊     | 96/200 [00:30<00:16,  6.46it/s, mae=97.24]Training:  48%|████▊     | 96/200 [00:31<00:16,  6.46it/s, mae=96.94]Training:  48%|████▊     | 97/200 [00:31<00:15,  6.44it/s, mae=96.94]Training:  48%|████▊     | 97/200 [00:31<00:15,  6.44it/s, mae=96.57]Training:  49%|████▉     | 98/200 [00:31<00:15,  6.60it/s, mae=96.57]Training:  49%|████▉     | 98/200 [00:31<00:15,  6.60it/s, mae=96.22]Training:  50%|████▉     | 99/200 [00:31<00:15,  6.70it/s, mae=96.22]Training:  50%|████▉     | 99/200 [00:31<00:15,  6.70it/s, mae=95.79]Training:  50%|█████     | 100/200 [00:31<00:14,  6.76it/s, mae=95.79]Training:  50%|█████     | 100/200 [00:31<00:14,  6.76it/s, mae=95.46]Training:  50%|█████     | 101/200 [00:31<00:14,  6.82it/s, mae=95.46]Training:  50%|█████     | 101/200 [00:31<00:14,  6.82it/s, mae=95.11]Training:  51%|█████     | 102/200 [00:31<00:14,  6.72it/s, mae=95.11]Training:  51%|█████     | 102/200 [00:32<00:14,  6.72it/s, mae=94.77]Training:  52%|█████▏    | 103/200 [00:32<00:14,  6.65it/s, mae=94.77]Training:  52%|█████▏    | 103/200 [00:32<00:14,  6.65it/s, mae=94.41]Training:  52%|█████▏    | 104/200 [00:32<00:14,  6.74it/s, mae=94.41]Training:  52%|█████▏    | 104/200 [00:32<00:14,  6.74it/s, mae=94.03]Training:  52%|█████▎    | 105/200 [00:32<00:14,  6.62it/s, mae=94.03]Training:  52%|█████▎    | 105/200 [00:32<00:14,  6.62it/s, mae=93.65]Training:  53%|█████▎    | 106/200 [00:32<00:13,  6.72it/s, mae=93.65]Training:  53%|█████▎    | 106/200 [00:32<00:13,  6.72it/s, mae=93.23]Training:  54%|█████▎    | 107/200 [00:32<00:13,  6.78it/s, mae=93.23]Training:  54%|█████▎    | 107/200 [00:32<00:13,  6.78it/s, mae=92.81]Training:  54%|█████▍    | 108/200 [00:32<00:13,  6.83it/s, mae=92.81]Training:  54%|█████▍    | 108/200 [00:32<00:13,  6.83it/s, mae=92.40]Training:  55%|█████▍    | 109/200 [00:32<00:13,  6.69it/s, mae=92.40]Training:  55%|█████▍    | 109/200 [00:33<00:13,  6.69it/s, mae=92.17]Training:  55%|█████▌    | 110/200 [00:33<00:13,  6.77it/s, mae=92.17]Training:  55%|█████▌    | 110/200 [00:33<00:13,  6.77it/s, mae=91.77]Training:  56%|█████▌    | 111/200 [00:33<00:13,  6.58it/s, mae=91.77]Training:  56%|█████▌    | 111/200 [00:33<00:13,  6.58it/s, mae=91.40]Training:  56%|█████▌    | 112/200 [00:33<00:13,  6.71it/s, mae=91.40]Training:  56%|█████▌    | 112/200 [00:33<00:13,  6.71it/s, mae=91.01]Training:  56%|█████▋    | 113/200 [00:33<00:13,  6.69it/s, mae=91.01]Training:  56%|█████▋    | 113/200 [00:33<00:13,  6.69it/s, mae=90.65]Training:  57%|█████▋    | 114/200 [00:33<00:12,  6.76it/s, mae=90.65]Training:  57%|█████▋    | 114/200 [00:33<00:12,  6.76it/s, mae=90.33]Training:  57%|█████▊    | 115/200 [00:33<00:12,  6.76it/s, mae=90.33]Training:  57%|█████▊    | 115/200 [00:33<00:12,  6.76it/s, mae=89.99]Training:  58%|█████▊    | 116/200 [00:33<00:12,  6.81it/s, mae=89.99]Training:  58%|█████▊    | 116/200 [00:34<00:12,  6.81it/s, mae=89.47]Training:  58%|█████▊    | 117/200 [00:34<00:12,  6.62it/s, mae=89.47]Training:  58%|█████▊    | 117/200 [00:34<00:12,  6.62it/s, mae=89.09]Training:  59%|█████▉    | 118/200 [00:34<00:12,  6.72it/s, mae=89.09]Training:  59%|█████▉    | 118/200 [00:34<00:12,  6.72it/s, mae=88.74]Training:  60%|█████▉    | 119/200 [00:34<00:11,  6.80it/s, mae=88.74]Training:  60%|█████▉    | 119/200 [00:34<00:11,  6.80it/s, mae=88.35]Training:  60%|██████    | 120/200 [00:34<00:11,  6.80it/s, mae=88.35]Training:  60%|██████    | 120/200 [00:34<00:11,  6.80it/s, mae=87.95]Training:  60%|██████    | 121/200 [00:34<00:11,  6.84it/s, mae=87.95]Training:  60%|██████    | 121/200 [00:34<00:11,  6.84it/s, mae=87.54]Training:  61%|██████    | 122/200 [00:34<00:11,  6.73it/s, mae=87.54]Training:  61%|██████    | 122/200 [00:34<00:11,  6.73it/s, mae=87.13]Training:  62%|██████▏   | 123/200 [00:34<00:11,  6.80it/s, mae=87.13]Training:  62%|██████▏   | 123/200 [00:35<00:11,  6.80it/s, mae=86.77]Training:  62%|██████▏   | 124/200 [00:35<00:11,  6.85it/s, mae=86.77]Training:  62%|██████▏   | 124/200 [00:35<00:11,  6.85it/s, mae=86.42]Training:  62%|██████▎   | 125/200 [00:35<00:10,  6.85it/s, mae=86.42]Training:  62%|██████▎   | 125/200 [00:35<00:10,  6.85it/s, mae=86.01]Training:  63%|██████▎   | 126/200 [00:35<00:11,  6.63it/s, mae=86.01]Training:  63%|██████▎   | 126/200 [00:35<00:11,  6.63it/s, mae=85.58]Training:  64%|██████▎   | 127/200 [00:35<00:11,  6.49it/s, mae=85.58]Training:  64%|██████▎   | 127/200 [00:35<00:11,  6.49it/s, mae=85.15]Training:  64%|██████▍   | 128/200 [00:35<00:10,  6.62it/s, mae=85.15]Training:  64%|██████▍   | 128/200 [00:35<00:10,  6.62it/s, mae=84.80]Training:  64%|██████▍   | 129/200 [00:35<00:10,  6.72it/s, mae=84.80]Training:  64%|██████▍   | 129/200 [00:36<00:10,  6.72it/s, mae=84.42]Training:  65%|██████▌   | 130/200 [00:36<00:10,  6.80it/s, mae=84.42]Training:  65%|██████▌   | 130/200 [00:36<00:10,  6.80it/s, mae=84.03]Training:  66%|██████▌   | 131/200 [00:36<00:10,  6.83it/s, mae=84.03]Training:  66%|██████▌   | 131/200 [00:36<00:10,  6.83it/s, mae=83.59]Training:  66%|██████▌   | 132/200 [00:36<00:10,  6.62it/s, mae=83.59]Training:  66%|██████▌   | 132/200 [00:36<00:10,  6.62it/s, mae=83.21]Training:  66%|██████▋   | 133/200 [00:36<00:10,  6.41it/s, mae=83.21]Training:  66%|██████▋   | 133/200 [00:36<00:10,  6.41it/s, mae=82.80]Training:  67%|██████▋   | 134/200 [00:36<00:10,  6.52it/s, mae=82.80]Training:  67%|██████▋   | 134/200 [00:36<00:10,  6.52it/s, mae=82.38]Training:  68%|██████▊   | 135/200 [00:36<00:09,  6.65it/s, mae=82.38]Training:  68%|██████▊   | 135/200 [00:36<00:09,  6.65it/s, mae=81.93]Training:  68%|██████▊   | 136/200 [00:36<00:09,  6.54it/s, mae=81.93]Training:  68%|██████▊   | 136/200 [00:37<00:09,  6.54it/s, mae=81.51]Training:  68%|██████▊   | 137/200 [00:37<00:09,  6.66it/s, mae=81.51]Training:  68%|██████▊   | 137/200 [00:37<00:09,  6.66it/s, mae=81.11]Training:  69%|██████▉   | 138/200 [00:37<00:09,  6.69it/s, mae=81.11]Training:  69%|██████▉   | 138/200 [00:37<00:09,  6.69it/s, mae=80.76]Training:  70%|██████▉   | 139/200 [00:37<00:09,  6.76it/s, mae=80.76]Training:  70%|██████▉   | 139/200 [00:37<00:09,  6.76it/s, mae=80.35]Training:  70%|███████   | 140/200 [00:37<00:09,  6.55it/s, mae=80.35]Training:  70%|███████   | 140/200 [00:37<00:09,  6.55it/s, mae=80.04]Training:  70%|███████   | 141/200 [00:37<00:09,  6.46it/s, mae=80.04]Training:  70%|███████   | 141/200 [00:37<00:09,  6.46it/s, mae=79.70]Training:  71%|███████   | 142/200 [00:37<00:08,  6.60it/s, mae=79.70]Training:  71%|███████   | 142/200 [00:37<00:08,  6.60it/s, mae=79.37]Training:  72%|███████▏  | 143/200 [00:37<00:08,  6.70it/s, mae=79.37]Training:  72%|███████▏  | 143/200 [00:38<00:08,  6.70it/s, mae=79.04]Training:  72%|███████▏  | 144/200 [00:38<00:08,  6.75it/s, mae=79.04]Training:  72%|███████▏  | 144/200 [00:38<00:08,  6.75it/s, mae=78.70]Training:  72%|███████▎  | 145/200 [00:38<00:08,  6.82it/s, mae=78.70]Training:  72%|███████▎  | 145/200 [00:38<00:08,  6.82it/s, mae=78.35]Training:  73%|███████▎  | 146/200 [00:38<00:07,  6.86it/s, mae=78.35]Training:  73%|███████▎  | 146/200 [00:38<00:07,  6.86it/s, mae=78.04]Training:  74%|███████▎  | 147/200 [00:38<00:07,  6.89it/s, mae=78.04]Training:  74%|███████▎  | 147/200 [00:38<00:07,  6.89it/s, mae=77.73]Training:  74%|███████▍  | 148/200 [00:38<00:07,  6.67it/s, mae=77.73]Training:  74%|███████▍  | 148/200 [00:38<00:07,  6.67it/s, mae=77.36]Training:  74%|███████▍  | 149/200 [00:38<00:07,  6.62it/s, mae=77.36]Training:  74%|███████▍  | 149/200 [00:39<00:07,  6.62it/s, mae=77.02]Training:  75%|███████▌  | 150/200 [00:39<00:07,  6.72it/s, mae=77.02]Training:  75%|███████▌  | 150/200 [00:39<00:07,  6.72it/s, mae=76.69]Training:  76%|███████▌  | 151/200 [00:39<00:07,  6.68it/s, mae=76.69]Training:  76%|███████▌  | 151/200 [00:39<00:07,  6.68it/s, mae=76.36]Training:  76%|███████▌  | 152/200 [00:39<00:07,  6.68it/s, mae=76.36]Training:  76%|███████▌  | 152/200 [00:39<00:07,  6.68it/s, mae=76.04]Training:  76%|███████▋  | 153/200 [00:39<00:07,  6.71it/s, mae=76.04]Training:  76%|███████▋  | 153/200 [00:39<00:07,  6.71it/s, mae=75.69]Training:  77%|███████▋  | 154/200 [00:39<00:07,  6.45it/s, mae=75.69]Training:  77%|███████▋  | 154/200 [00:39<00:07,  6.45it/s, mae=75.39]Training:  78%|███████▊  | 155/200 [00:39<00:06,  6.60it/s, m