Training:   0%|          | 0/200 [00:00<?, ?it/s]Training:   0%|          | 0/200 [00:01<?, ?it/s, mae=132.59]Training:   0%|          | 1/200 [00:01<06:31,  1.97s/it, mae=132.59]Training:   0%|          | 1/200 [00:02<06:31,  1.97s/it, mae=128.90]Training:   1%|          | 2/200 [00:02<03:49,  1.16s/it, mae=128.90]Training:   1%|          | 2/200 [00:03<03:49,  1.16s/it, mae=126.33]Training:   2%|▏         | 3/200 [00:03<02:52,  1.14it/s, mae=126.33]Training:   2%|▏         | 3/200 [00:03<02:52,  1.14it/s, mae=128.44]Training:   2%|▏         | 4/200 [00:03<02:25,  1.34it/s, mae=128.44]Training:   2%|▏         | 4/200 [00:04<02:25,  1.34it/s, mae=128.30]Training:   2%|▎         | 5/200 [00:04<02:12,  1.48it/s, mae=128.30]Training:   2%|▎         | 5/200 [00:04<02:12,  1.48it/s, mae=125.21]Training:   3%|▎         | 6/200 [00:04<02:01,  1.59it/s, mae=125.21]Training:   3%|▎         | 6/200 [00:05<02:01,  1.59it/s, mae=125.78]Training:   4%|▎         | 7/200 [00:05<01:57,  1.64it/s, mae=125.78]Training:   4%|▎         | 7/200 [00:05<01:57,  1.64it/s, mae=125.33]Training:   4%|▍         | 8/200 [00:05<01:53,  1.70it/s, mae=125.33]Training:   4%|▍         | 8/200 [00:06<01:53,  1.70it/s, mae=125.42]Training:   4%|▍         | 9/200 [00:06<01:50,  1.73it/s, mae=125.42]Training:   4%|▍         | 9/200 [00:06<01:50,  1.73it/s, mae=125.87]Training:   5%|▌         | 10/200 [00:06<01:47,  1.77it/s, mae=125.87]Training:   5%|▌         | 10/200 [00:07<01:47,  1.77it/s, mae=126.87]Training:   6%|▌         | 11/200 [00:07<01:47,  1.76it/s, mae=126.87]Training:   6%|▌         | 11/200 [00:08<01:47,  1.76it/s, mae=126.59]Training:   6%|▌         | 12/200 [00:08<01:46,  1.76it/s, mae=126.59]Training:   6%|▌         | 12/200 [00:08<01:46,  1.76it/s, mae=126.64]Training:   6%|▋         | 13/200 [00:08<01:44,  1.80it/s, mae=126.64]Training:   6%|▋         | 13/200 [00:09<01:44,  1.80it/s, mae=127.23]Training:   7%|▋         | 14/200 [00:09<01:44,  1.77it/s, mae=127.23]Training:   7%|▋         | 14/200 [00:09<01:44,  1.77it/s, mae=127.29]Training:   8%|▊         | 15/200 [00:09<01:42,  1.80it/s, mae=127.29]Training:   8%|▊         | 15/200 [00:10<01:42,  1.80it/s, mae=126.85]Training:   8%|▊         | 16/200 [00:10<01:40,  1.83it/s, mae=126.85]Training:   8%|▊         | 16/200 [00:10<01:40,  1.83it/s, mae=126.85]Training:   8%|▊         | 17/200 [00:10<01:39,  1.85it/s, mae=126.85]Training:   8%|▊         | 17/200 [00:11<01:39,  1.85it/s, mae=126.52]Training:   9%|▉         | 18/200 [00:11<01:39,  1.83it/s, mae=126.52]Training:   9%|▉         | 18/200 [00:11<01:39,  1.83it/s, mae=126.47]Training:  10%|▉         | 19/200 [00:11<01:40,  1.80it/s, mae=126.47]Training:  10%|▉         | 19/200 [00:12<01:40,  1.80it/s, mae=126.34]Training:  10%|█         | 20/200 [00:12<01:39,  1.81it/s, mae=126.34]Training:  10%|█         | 20/200 [00:13<01:39,  1.81it/s, mae=126.91]Training:  10%|█         | 21/200 [00:13<01:39,  1.80it/s, mae=126.91]Training:  10%|█         | 21/200 [00:13<01:39,  1.80it/s, mae=126.51]Training:  11%|█         | 22/200 [00:13<01:38,  1.80it/s, mae=126.51]Training:  11%|█         | 22/200 [00:14<01:38,  1.80it/s, mae=126.91]Training:  12%|█▏        | 23/200 [00:14<01:37,  1.82it/s, mae=126.91]Training:  12%|█▏        | 23/200 [00:14<01:37,  1.82it/s, mae=126.76]Training:  12%|█▏        | 24/200 [00:14<01:35,  1.84it/s, mae=126.76]Training:  12%|█▏        | 24/200 [00:15<01:35,  1.84it/s, mae=127.14]Training:  12%|█▎        | 25/200 [00:15<01:35,  1.83it/s, mae=127.14]Training:  12%|█▎        | 25/200 [00:15<01:35,  1.83it/s, mae=126.98]Training:  13%|█▎        | 26/200 [00:15<01:37,  1.78it/s, mae=126.98]Training:  13%|█▎        | 26/200 [00:16<01:37,  1.78it/s, mae=126.59]Training:  14%|█▎        | 27/200 [00:16<01:35,  1.81it/s, mae=126.59]Training:  14%|█▎        | 27/200 [00:16<01:35,  1.81it/s, mae=126.38]Training:  14%|█▍        | 28/200 [00:16<01:33,  1.83it/s, mae=126.38]Training:  14%|█▍        | 28/200 [00:17<01:33,  1.83it/s, mae=126.11]Training:  14%|█▍        | 29/200 [00:17<01:34,  1.80it/s, mae=126.11]Training:  14%|█▍        | 29/200 [00:18<01:34,  1.80it/s, mae=126.07]Training:  15%|█▌        | 30/200 [00:18<01:35,  1.79it/s, mae=126.07]Training:  15%|█▌        | 30/200 [00:18<01:35,  1.79it/s, mae=125.52]Training:  16%|█▌        | 31/200 [00:18<01:33,  1.81it/s, mae=125.52]Training:  16%|█▌        | 31/200 [00:19<01:33,  1.81it/s, mae=125.71]Training:  16%|█▌        | 32/200 [00:19<01:33,  1.80it/s, mae=125.71]Training:  16%|█▌        | 32/200 [00:19<01:33,  1.80it/s, mae=125.25]Training:  16%|█▋        | 33/200 [00:19<01:33,  1.78it/s, mae=125.25]Training:  16%|█▋        | 33/200 [00:20<01:33,  1.78it/s, mae=125.50]Training:  17%|█▋        | 34/200 [00:20<01:33,  1.78it/s, mae=125.50]Training:  17%|█▋        | 34/200 [00:20<01:33,  1.78it/s, mae=125.37]Training:  18%|█▊        | 35/200 [00:20<01:32,  1.79it/s, mae=125.37]Training:  18%|█▊        | 35/200 [00:21<01:32,  1.79it/s, mae=125.30]Training:  18%|█▊        | 36/200 [00:21<01:30,  1.81it/s, mae=125.30]Training:  18%|█▊        | 36/200 [00:21<01:30,  1.81it/s, mae=125.22]Training:  18%|█▊        | 37/200 [00:21<01:28,  1.83it/s, mae=125.22]Training:  18%|█▊        | 37/200 [00:22<01:28,  1.83it/s, mae=125.15]Training:  19%|█▉        | 38/200 [00:22<01:27,  1.85it/s, mae=125.15]Training:  19%|█▉        | 38/200 [00:22<01:27,  1.85it/s, mae=125.11]Training:  20%|█▉        | 39/200 [00:22<01:29,  1.80it/s, mae=125.11]Training:  20%|█▉        | 39/200 [00:23<01:29,  1.80it/s, mae=125.24]Training:  20%|██        | 40/200 [00:23<01:29,  1.79it/s, mae=125.24]Training:  20%|██        | 40/200 [00:24<01:29,  1.79it/s, mae=124.79]Training:  20%|██        | 41/200 [00:24<01:30,  1.75it/s, mae=124.79]Training:  20%|██        | 41/200 [00:24<01:30,  1.75it/s, mae=124.62]Training:  21%|██        | 42/200 [00:24<01:30,  1.74it/s, mae=124.62]Training:  21%|██        | 42/200 [00:25<01:30,  1.74it/s, mae=124.62]Training:  22%|██▏       | 43/200 [00:25<01:28,  1.78it/s, mae=124.62]Training:  22%|██▏       | 43/200 [00:25<01:28,  1.78it/s, mae=124.60]Training:  22%|██▏       | 44/200 [00:25<01:26,  1.81it/s, mae=124.60]Training:  22%|██▏       | 44/200 [00:26<01:26,  1.81it/s, mae=124.39]Training:  22%|██▎       | 45/200 [00:26<01:24,  1.83it/s, mae=124.39]Training:  22%|██▎       | 45/200 [00:26<01:24,  1.83it/s, mae=124.45]Training:  23%|██▎       | 46/200 [00:26<01:26,  1.79it/s, mae=124.45]Training:  23%|██▎       | 46/200 [00:27<01:26,  1.79it/s, mae=124.33]Training:  24%|██▎       | 47/200 [00:27<01:26,  1.76it/s, mae=124.33]Training:  24%|██▎       | 47/200 [00:28<01:26,  1.76it/s, mae=124.48]Training:  24%|██▍       | 48/200 [00:28<01:24,  1.80it/s, mae=124.48]Training:  24%|██▍       | 48/200 [00:28<01:24,  1.80it/s, mae=124.40]Training:  24%|██▍       | 49/200 [00:28<01:24,  1.78it/s, mae=124.40]Training:  24%|██▍       | 49/200 [00:29<01:24,  1.78it/s, mae=124.24]Training:  25%|██▌       | 50/200 [00:29<01:22,  1.81it/s, mae=124.24]Training:  25%|██▌       | 50/200 [00:29<01:22,  1.81it/s, mae=124.10]Training:  26%|██▌       | 51/200 [00:29<01:21,  1.83it/s, mae=124.10]Training:  26%|██▌       | 51/200 [00:30<01:21,  1.83it/s, mae=124.04]Training:  26%|██▌       | 52/200 [00:30<01:20,  1.84it/s, mae=124.04]Training:  26%|██▌       | 52/200 [00:30<01:20,  1.84it/s, mae=123.86]Training:  26%|██▋       | 53/200 [00:30<01:19,  1.85it/s, mae=123.86]Training:  26%|██▋       | 53/200 [00:31<01:19,  1.85it/s, mae=123.66]Training:  27%|██▋       | 54/200 [00:31<01:20,  1.82it/s, mae=123.66]Training:  27%|██▋       | 54/200 [00:31<01:20,  1.82it/s, mae=123.81]Training:  28%|██▊       | 55/200 [00:31<01:18,  1.84it/s, mae=123.81]Training:  28%|██▊       | 55/200 [00:32<01:18,  1.84it/s, mae=123.64]Training:  28%|██▊       | 56/200 [00:32<01:19,  1.81it/s, mae=123.64]Training:  28%|██▊       | 56/200 [00:32<01:19,  1.81it/s, mae=123.65]Training:  28%|██▊       | 57/200 [00:32<01:19,  1.79it/s, mae=123.65]Training:  28%|██▊       | 57/200 [00:33<01:19,  1.79it/s, mae=123.54]Training:  29%|██▉       | 58/200 [00:33<01:20,  1.77it/s, mae=123.54]Training:  29%|██▉       | 58/200 [00:34<01:20,  1.77it/s, mae=123.61]Training:  30%|██▉       | 59/200 [00:34<01:20,  1.75it/s, mae=123.61]Training:  30%|██▉       | 59/200 [00:34<01:20,  1.75it/s, mae=123.59]Training:  30%|███       | 60/200 [00:34<01:18,  1.79it/s, mae=123.59]Training:  30%|███       | 60/200 [00:35<01:18,  1.79it/s, mae=123.38]Training:  30%|███       | 61/200 [00:35<01:16,  1.81it/s, mae=123.38]Training:  30%|███       | 61/200 [00:35<01:16,  1.81it/s, mae=123.45]Training:  31%|███       | 62/200 [00:35<01:15,  1.83it/s, mae=123.45]Training:  31%|███       | 62/200 [00:36<01:15,  1.83it/s, mae=123.28]Training:  32%|███▏      | 63/200 [00:36<01:15,  1.81it/s, mae=123.28]Training:  32%|███▏      | 63/200 [00:36<01:15,  1.81it/s, mae=123.23]Training:  32%|███▏      | 64/200 [00:36<01:16,  1.79it/s, mae=123.23]Training:  32%|███▏      | 64/200 [00:37<01:16,  1.79it/s, mae=123.22]Training:  32%|███▎      | 65/200 [00:37<01:14,  1.81it/s, mae=123.22]Training:  32%|███▎      | 65/200 [00:37<01:14,  1.81it/s, mae=123.14]Training:  33%|███▎      | 66/200 [00:37<01:13,  1.83it/s, mae=123.14]Training:  33%|███▎      | 66/200 [00:38<01:13,  1.83it/s, mae=123.03]Training:  34%|███▎      | 67/200 [00:38<01:12,  1.84it/s, mae=123.03]Training:  34%|███▎      | 67/200 [00:39<01:12,  1.84it/s, mae=123.11]Training:  34%|███▍      | 68/200 [00:39<01:12,  1.83it/s, mae=123.11]Training:  34%|███▍      | 68/200 [00:39<01:12,  1.83it/s, mae=123.07]Training:  34%|███▍      | 69/200 [00:39<01:11,  1.84it/s, mae=123.07]Training:  34%|███▍      | 69/200 [00:40<01:11,  1.84it/s, mae=123.00]Training:  35%|███▌      | 70/200 [00:40<01:10,  1.85it/s, mae=123.00]Training:  35%|███▌      | 70/200 [00:40<01:10,  1.85it/s, mae=122.88]Training:  36%|███▌      | 71/200 [00:40<01:09,  1.86it/s, mae=122.88]Training:  36%|███▌      | 71/200 [00:41<01:09,  1.86it/s, mae=122.85]Training:  36%|███▌      | 72/200 [00:41<01:08,  1.86it/s, mae=122.85]Training:  36%|███▌      | 72/200 [00:41<01:08,  1.86it/s, mae=122.97]Training:  36%|███▋      | 73/200 [00:41<01:09,  1.84it/s, mae=122.97]Training:  36%|███▋      | 73/200 [00:42<01:09,  1.84it/s, mae=122.78]Training:  37%|███▋      | 74/200 [00:42<01:08,  1.85it/s, mae=122.78]Training:  37%|███▋      | 74/200 [00:42<01:08,  1.85it/s, mae=122.79]Training:  38%|███▊      | 75/200 [00:42<01:07,  1.86it/s, mae=122.79]Training:  38%|███▊      | 75/200 [00:43<01:07,  1.86it/s, mae=122.77]Training:  38%|███▊      | 76/200 [00:43<01:06,  1.87it/s, mae=122.77]Training:  38%|███▊      | 76/200 [00:43<01:06,  1.87it/s, mae=122.64]Training:  38%|███▊      | 77/200 [00:43<01:05,  1.87it/s, mae=122.64]Training:  38%|███▊      | 77/200 [00:44<01:05,  1.87it/s, mae=122.43]Training:  39%|███▉      | 78/200 [00:44<01:05,  1.87it/s, mae=122.43]Training:  39%|███▉      | 78/200 [00:44<01:05,  1.87it/s, mae=122.38]Training:  40%|███▉      | 79/200 [00:44<01:04,  1.87it/s, mae=122.38]Training:  40%|███▉      | 79/200 [00:45<01:04,  1.87it/s, mae=122.32]Training:  40%|████      | 80/200 [00:45<01:03,  1.88it/s, mae=122.32]Training:  40%|████      | 80/200 [00:45<01:03,  1.88it/s, mae=122.18]Training:  40%|████      | 81/200 [00:45<01:03,  1.88it/s, mae=122.18]Training:  40%|████      | 81/200 [00:46<01:03,  1.88it/s, mae=122.14]Training:  41%|████      | 82/200 [00:46<01:03,  1.86it/s, mae=122.14]Training:  41%|████      | 82/200 [00:47<01:03,  1.86it/s, mae=122.06]Training:  42%|████▏     | 83/200 [00:47<01:02,  1.86it/s, mae=122.06]Training:  42%|████▏     | 83/200 [00:47<01:02,  1.86it/s, mae=122.01]Training:  42%|████▏     | 84/200 [00:47<01:02,  1.87it/s, mae=122.01]Training:  42%|████▏     | 84/200 [00:48<01:02,  1.87it/s, mae=122.04]Training:  42%|████▎     | 85/200 [00:48<01:01,  1.87it/s, mae=122.04]Training:  42%|████▎     | 85/200 [00:48<01:01,  1.87it/s, mae=121.76]Training:  43%|████▎     | 86/200 [00:48<01:00,  1.87it/s, mae=121.76]Training:  43%|████▎     | 86/200 [00:49<01:00,  1.87it/s, mae=121.69]Training:  44%|████▎     | 87/200 [00:49<01:00,  1.87it/s, mae=121.69]Training:  44%|████▎     | 87/200 [00:49<01:00,  1.87it/s, mae=121.64]Training:  44%|████▍     | 88/200 [00:49<00:59,  1.87it/s, mae=121.64]Training:  44%|████▍     | 88/200 [00:50<00:59,  1.87it/s, mae=121.55]Training:  44%|████▍     | 89/200 [00:50<00:59,  1.87it/s, mae=121.55]Training:  44%|████▍     | 89/200 [00:50<00:59,  1.87it/s, mae=121.62]Training:  45%|████▌     | 90/200 [00:50<00:58,  1.88it/s, mae=121.62]Training:  45%|████▌     | 90/200 [00:51<00:58,  1.88it/s, mae=121.50]Training:  46%|████▌     | 91/200 [00:51<00:58,  1.88it/s, mae=121.50]Training:  46%|████▌     | 91/200 [00:51<00:58,  1.88it/s, mae=121.45]Training:  46%|████▌     | 92/200 [00:51<00:59,  1.81it/s, mae=121.45]Training:  46%|████▌     | 92/200 [00:52<00:59,  1.81it/s, mae=121.23]Training:  46%|████▋     | 93/200 [00:52<00:59,  1.81it/s, mae=121.23]Training:  46%|████▋     | 93/200 [00:53<00:59,  1.81it/s, mae=121.01]Training:  47%|████▋     | 94/200 [00:53<00:57,  1.83it/s, mae=121.01]Training:  47%|████▋     | 94/200 [00:53<00:57,  1.83it/s, mae=120.98]Training:  48%|████▊     | 95/200 [00:53<00:56,  1.84it/s, mae=120.98]Training:  48%|████▊     | 95/200 [00:54<00:56,  1.84it/s, mae=120.87]Training:  48%|████▊     | 96/200 [00:54<00:56,  1.85it/s, mae=120.87]Training:  48%|████▊     | 96/200 [00:54<00:56,  1.85it/s, mae=120.63]Training:  48%|████▊     | 97/200 [00:54<00:55,  1.86it/s, mae=120.63]Training:  48%|████▊     | 97/200 [00:55<00:55,  1.86it/s, mae=120.50]Training:  49%|████▉     | 98/200 [00:55<00:54,  1.86it/s, mae=120.50]Training:  49%|████▉     | 98/200 [00:55<00:54,  1.86it/s, mae=120.50]Training:  50%|████▉     | 99/200 [00:55<00:54,  1.87it/s, mae=120.50]Training:  50%|████▉     | 99/200 [00:56<00:54,  1.87it/s, mae=120.40]Training:  50%|█████     | 100/200 [00:56<00:53,  1.87it/s, mae=120.40]Training:  50%|█████     | 100/200 [00:56<00:53,  1.87it/s, mae=120.32]Training:  50%|█████     | 101/200 [00:56<00:52,  1.87it/s, mae=120.32]Training:  50%|█████     | 101/200 [00:57<00:52,  1.87it/s, mae=120.14]Training:  51%|█████     | 102/200 [00:57<00:52,  1.87it/s, mae=120.14]Training:  51%|█████     | 102/200 [00:57<00:52,  1.87it/s, mae=120.11]Training:  52%|█████▏    | 103/200 [00:57<00:51,  1.88it/s, mae=120.11]Training:  52%|█████▏    | 103/200 [00:58<00:51,  1.88it/s, mae=120.05]Training:  52%|█████▏    | 104/200 [00:58<00:51,  1.88it/s, mae=120.05]Training:  52%|█████▏    | 104/200 [00:58<00:51,  1.88it/s, mae=119.93]Training:  52%|█████▎    | 105/200 [00:58<00:50,  1.88it/s, mae=119.93]Training:  52%|█████▎    | 105/200 [00:59<00:50,  1.88it/s, mae=119.82]Training:  53%|█████▎    | 106/200 [00:59<00:50,  1.88it/s, mae=119.82]Training:  53%|█████▎    | 106/200 [00:59<00:50,  1.88it/s, mae=119.66]Training:  54%|█████▎    | 107/200 [00:59<00:49,  1.88it/s, mae=119.66]Training:  54%|█████▎    | 107/200 [01:00<00:49,  1.88it/s, mae=119.56]Training:  54%|█████▍    | 108/200 [01:00<00:48,  1.88it/s, mae=119.56]Training:  54%|█████▍    | 108/200 [01:01<00:48,  1.88it/s, mae=119.60]Training:  55%|█████▍    | 109/200 [01:01<00:48,  1.88it/s, mae=119.60]Training:  55%|█████▍    | 109/200 [01:01<00:48,  1.88it/s, mae=119.51]Training:  55%|█████▌    | 110/200 [01:01<00:47,  1.88it/s, mae=119.51]Training:  55%|█████▌    | 110/200 [01:02<00:47,  1.88it/s, mae=119.44]Training:  56%|█████▌    | 111/200 [01:02<00:47,  1.88it/s, mae=119.44]Training:  56%|█████▌    | 111/200 [01:02<00:47,  1.88it/s, mae=119.31]Training:  56%|█████▌    | 112/200 [01:02<00:46,  1.88it/s, mae=119.31]Training:  56%|█████▌    | 112/200 [01:03<00:46,  1.88it/s, mae=119.26]Training:  56%|█████▋    | 113/200 [01:03<00:46,  1.88it/s, mae=119.26]Training:  56%|█████▋    | 113/200 [01:03<00:46,  1.88it/s, mae=119.27]Training:  57%|█████▋    | 114/200 [01:03<00:45,  1.88it/s, mae=119.27]Training:  57%|█████▋    | 114/200 [01:04<00:45,  1.88it/s, mae=119.18]Training:  57%|█████▊    | 115/200 [01:04<00:45,  1.88it/s, mae=119.18]Training:  57%|█████▊    | 115/200 [01:04<00:45,  1.88it/s, mae=119.07]Training:  58%|█████▊    | 116/200 [01:04<00:44,  1.88it/s, mae=119.07]Training:  58%|█████▊    | 116/200 [01:05<00:44,  1.88it/s, mae=119.03]Training:  58%|█████▊    | 117/200 [01:05<00:44,  1.88it/s, mae=119.03]Training:  58%|█████▊    | 117/200 [01:05<00:44,  1.88it/s, mae=119.05]Training:  59%|█████▉    | 118/200 [01:05<00:43,  1.88it/s, mae=119.05]Training:  59%|█████▉    | 118/200 [01:06<00:43,  1.88it/s, mae=118.89]Training:  60%|█████▉    | 119/200 [01:06<00:44,  1.82it/s, mae=118.89]Training:  60%|█████▉    | 119/200 [01:06<00:44,  1.82it/s, mae=118.83]Training:  60%|██████    | 120/200 [01:06<00:43,  1.83it/s, mae=118.83]Training:  60%|██████    | 120/200 [01:07<00:43,  1.83it/s, mae=118.74]Training:  60%|██████    | 121/200 [01:07<00:42,  1.85it/s, mae=118.74]Training:  60%|██████    | 121/200 [01:08<00:42,  1.85it/s, mae=118.71]Training:  61%|██████    | 122/200 [01:08<00:42,  1.84it/s, mae=118.71]Training:  61%|██████    | 122/200 [01:08<00:42,  1.84it/s, mae=118.69]Training:  62%|██████▏   | 123/200 [01:08<00:41,  1.85it/s, mae=118.69]Training:  62%|██████▏   | 123/200 [01:09<00:41,  1.85it/s, mae=118.65]Training:  62%|██████▏   | 124/200 [01:09<00:40,  1.86it/s, mae=118.65]Training:  62%|██████▏   | 124/200 [01:09<00:40,  1.86it/s, mae=118.52]Training:  62%|██████▎   | 125/200 [01:09<00:40,  1.87it/s, mae=118.52]Training:  62%|██████▎   | 125/200 [01:10<00:40,  1.87it/s, mae=118.44]Training:  63%|██████▎   | 126/200 [01:10<00:39,  1.87it/s, mae=118.44]Training:  63%|██████▎   | 126/200 [01:10<00:39,  1.87it/s, mae=118.36]Training:  64%|██████▎   | 127/200 [01:10<00:38,  1.87it/s, mae=118.36]Training:  64%|██████▎   | 127/200 [01:11<00:38,  1.87it/s, mae=118.31]Training:  64%|██████▍   | 128/200 [01:11<00:38,  1.88it/s, mae=118.31]Training:  64%|██████▍   | 128/200 [01:11<00:38,  1.88it/s, mae=118.20]Training:  64%|██████▍   | 129/200 [01:11<00:37,  1.88it/s, mae=118.20]Training:  64%|██████▍   | 129/200 [01:12<00:37,  1.88it/s, mae=118.06]Training:  65%|██████▌   | 130/200 [01:12<00:38,  1.83it/s, mae=118.06]Training:  65%|██████▌   | 130/200 [01:12<00:38,  1.83it/s, mae=117.94]Training:  66%|██████▌   | 131/200 [01:12<00:37,  1.84it/s, mae=117.94]Training:  66%|██████▌   | 131/200 [01:13<00:37,  1.84it/s, mae=117.74]Training:  66%|██████▌   | 132/200 [01:13<00:36,  1.85it/s, mae=117.74]Training:  66%|██████▌   | 132/200 [01:13<00:36,  1.85it/s, mae=117.69]Training:  66%|██████▋   | 133/200 [01:13<00:36,  1.86it/s, mae=117.69]Training:  66%|██████▋   | 133/200 [01:14<00:36,  1.86it/s, mae=117.55]Training:  67%|██████▋   | 134/200 [01:14<00:35,  1.86it/s, mae=117.55]Training:  67%|██████▋   | 134/200 [01:14<00:35,  1.86it/s, mae=117.55]Training:  68%|██████▊   | 135/200 [01:14<00:34,  1.87it/s, mae=117.55]Training:  68%|██████▊   | 135/200 [01:15<00:34,  1.87it/s, mae=117.43]Training:  68%|██████▊   | 136/200 [01:15<00:34,  1.87it/s, mae=117.43]Training:  68%|██████▊   | 136/200 [01:16<00:34,  1.87it/s, mae=117.28]Training:  68%|██████▊   | 137/200 [01:16<00:33,  1.87it/s, mae=117.28]Training:  68%|██████▊   | 137/200 [01:16<00:33,  1.87it/s, mae=117.16]Training:  69%|██████▉   | 138/200 [01:16<00:33,  1.87it/s, mae=117.16]Training:  69%|██████▉   | 138/200 [01:17<00:33,  1.87it/s, mae=117.13]Training:  70%|██████▉   | 139/200 [01:17<00:32,  1.87it/s, mae=117.13]Training:  70%|██████▉   | 139/200 [01:17<00:32,  1.87it/s, mae=117.11]Training:  70%|███████   | 140/200 [01:17<00:31,  1.88it/s, mae=117.11]Training:  70%|███████   | 140/200 [01:18<00:31,  1.88it/s, mae=117.10]Training:  70%|███████   | 141/200 [01:18<00:31,  1.88it/s, mae=117.10]Training:  70%|███████   | 141/200 [01:18<00:31,  1.88it/s, mae=117.02]Training:  71%|███████   | 142/200 [01:18<00:30,  1.88it/s, mae=117.02]Training:  71%|███████   | 142/200 [01:19<00:30,  1.88it/s, mae=116.90]Training:  72%|███████▏  | 143/200 [01:19<00:30,  1.88it/s, mae=116.90]Training:  72%|███████▏  | 143/200 [01:19<00:30,  1.88it/s, mae=116.92]Training:  72%|███████▏  | 144/200 [01:19<00:29,  1.88it/s, mae=116.92]Training:  72%|███████▏  | 144/200 [01:20<00:29,  1.88it/s, mae=116.90]Training:  72%|███████▎  | 145/200 [01:20<00:29,  1.88it/s, mae=116.90]Training:  72%|███████▎  | 145/200 [01:20<00:29,  1.88it/s, mae=116.88]Training:  73%|███████▎  | 146/200 [01:20<00:28,  1.88it/s, mae=116.88]Training:  73%|███████▎  | 146/200 [01:21<00:28,  1.88it/s, mae=116.75]Training:  74%|███████▎  | 147/200 [01:21<00:29,  1.82it/s, mae=116.75]Training:  74%|███████▎  | 147/200 [01:21<00:29,  1.82it/s, mae=116.73]Training:  74%|███████▍  | 148/200 [01:21<00:28,  1.84it/s, mae=116.73]Training:  74%|███████▍  | 148/200 [01:22<00:28,  1.84it/s, mae=116.67]Training:  74%|███████▍  | 149/200 [01:22<00:27,  1.85it/s, mae=116.67]Training:  74%|███████▍  | 149/200 [01:23<00:27,  1.85it/s, mae=116.63]Training:  75%|███████▌  | 150/200 [01:23<00:26,  1.86it/s, mae=116.63]Training:  75%|███████▌  | 150/200 [01:23<00:26,  1.86it/s, mae=116.48]Training:  76%|███████▌  | 151/200 [01:23<00:26,  1.87it/s, mae=116.48]Training:  76%|███████▌  | 151/200 [01:24<00:26,  1.87it/s, mae=116.42]Training:  76%|███████▌  | 152/200 [01:24<00:25,  1.87it/s, mae=116.42]Training:  76%|███████▌  | 152/200 [01:24<00:25,  1.87it/s, mae=116.34]Training:  76%|███████▋  | 153/200 [01:24<00:25,  1.87it/s, mae=116.34]Training:  76%|███████▋  | 153/200 [01:25<00:25,  1.87it/s, mae=116.23]Training:  77%|███████▋  | 154/200 [01:25<00:24,  1.87it/s, mae=116.23]